absorb | absorption	plants	their roots systems	absorb water and the nutrients from the water			Plants absorb water and the nutrients from the water via their roots systems.
absorb | absorption	plant	the roots	absorbs the water			The part of the plant that absorbs the water is the roots.
absorb | absorption	plants		absorb		water	Plants need much more water than animals because they lose most of the water they absorb.
absorb | absorption	plants		absorb		water	Plants only absorb as much water as they need.
absorb | absorption	plants		absorbing light energy	obtain energy		Plants obtain energy by absorbing light energy.
acceleration	object	Earth	acceleration			Earth always produces the same acceleration on every object.
acceleration	bicycle	cyclist uses chemical energy provided by food	accelerate	to a chosen speed		For example, a cyclist uses chemical energy provided by food to accelerate a bicycle to a chosen speed.
acceleration	objects		acceleration			The change in an objects velocity is called acceleration.
acceleration	object		accelerates	velocity is changing		When an object accelerates its velocity is changing.
acceleration	moving object		acceleration	change in the speed or direction		A change in the speed or direction of a moving object is called acceleration.
accumulation	water droplets	condensed from vapor-saturated air	accumulations	clouds		Clouds are accumulations of water droplets, condensed from vapor-saturated air.
accumulation	land plants		accumulate		carbon	As land plants grow, they accumulate more and more carbon.
accumulation			gradual accumulation of small changes	large changes	over long periods of time	large changes are the result of the gradual accumulation of small changes over long periods of time.
accumulation	flowing water		accumulates		into larger depressions on the ground surface	Flowing water accumulates into larger depressions on the ground surface.
accumulation			accumulation | bringing things together			Accumulation is the process of bringing things together.
adaptation	animals	live in their environment	adaptation	features		The adaptation of animals are the features an animal has to live in their environment.
adaptation	animals | plants	conditions of the habitats in which they live	adapted			Animals and plants are adapted to the conditions of the habitats in which they live.
adaptation	plants | animals	changes in the environment	adapted			Plants and animals have adapted to changes in the environment for millions of years.
adaptation	plants		adapt			Even well watered plants may wilt if the plant cannot adapt it transpiration rate.
adaptation	organism		inherited characteristic	survival		Inherited characteristic of an organism that enhances its survival and reproduction in specific environments.
asexual reproduction			agamogenesis | reproduction		without the fusion of gametes	A more stringent definition is agamogenesis which is reproduction without the fusion of gametes
asexual reproduction	single-celled organisms such as the archaea, bacteria, and protists		reproduction			Asexual reproduction is the primary form of reproduction for single-celled organisms such as the archaea, bacteria, and protists
asexual reproduction	single organism		reproduction	offspring arise | inherit the genes of that parent only		Asexual reproduction is a mode of reproduction by which offspring arise from a single organism, and inherit the genes of that parent only
asexual reproduction	single parent		reproduction	offspring that are all genetically identical to the parent		reproduction that involves a single parent and results in offspring that are all genetically identical to the parent
asexual reproduction	single parent			offspring	occurs without the fusion of gametes	The generation of offspring from a single parent that occurs without the fusion of gametes (by budding, division of a single cell, or division of the entire organism into two or more parts).
attracts	water molecules	water vapor is cooled	attractions	condense and become liquid water		Students learned that when water vapor is cooled, attractions between water molecules cause them to condense and become liquid water.
attracts	plants	perfume their blooms	attract the insects and other animals	pollinate their flowers		Plants perfume their blooms to attract the insects and other animals they need to pollinate their flowers.
attracts	molecules	molecules in the liquid	attracted			Some molecules of water vapor contact the liquid water and are attracted by the molecules in the liquid.
attracts	water molecules		mutual attraction		water is in liquid phase	Most of the water is in the liquid phase, where it is held by the mutual attraction of water molecules.
attracts		something of interest	cause to come to a place			cause to come to a place or participate in a venture by offering something of interest
Blinking	eyelid		closing 			Blinking is a semi-autonomic rapid closing of the eyelid.
Blinking	eye		spread tears	remove irritants		It is an essential function of the eye that helps spread tears across and remove irritants from the surface of the cornea and conjunctiva.
Blinking	eyes	tears and a lubricant	irrigation	moisture to the eye		Blinking provides moisture to the eye by irrigation using tears and a lubricant the eyes secrete.
Blinking	eye		open and close		involuntarily	to open and close the eye, especially involuntarily
Blinking	we		blink	moisten | oxygenate the cornea	automatically	We automatically blink 10 to 15 times a minute to moisten and oxygenate the cornea
boiling	water	transfer of energy through movement	boiling			Convection is the transfer of energy through movement, such as boiling water.
boiling	water	temperatures above the boiling point		steam | water vapor		Steam is water vapor that is at temperatures above the boiling point of water.
boiling	water	large amounts of energy		change the state of water		The large amounts of energy required to change the state of water apply to both melting ice and boiling water.
boiling	water		boiling	bubbles		The bubbles seen when boiling water is not a chemical change.
boiling	water		phase change | boiling			Phase change examples are the melting of ice or the boiling of water.
breathe | breathing	us		breathe		oxygen	Plants need energy to give oxygen for us to breathe and animals need energy to search for more foods.
breathe | breathing	animals | plants		breathe		oxygen	All animals and plants need oxygen to breathe.
breathe | breathing	animals		breathe in oxygen		use it to extract energy from food	Animals breathe in oxygen and use it to extract energy from food.
breathe | breathing	plants		breathing			All the plants around you are breathing and releasing water, too.
breathe | breathing	animals		take in air  | breathing			Animals take in air by breathing.
breathe | breathing	humans		inhale | breathe	carbon dioxide	oxygen	Humans inhale (breathe in) oxygen and exhale (breathe out) carbon dioxide.
breathe | breathing		lungs	process | moves air in and out			Breathing is the process that moves air in and out of the lungs
breathe | breathing	mouth | nose	muscle contraction | muscle relaxation	process of respiration | inhaled | exhaled			The process of respiration, during which air is inhaled into the lungs through the mouth or nose due to muscle contraction and then exhaled due to muscle relaxation.
breathe | breathing	fish		breathes | taking | forcing it out			A fish breathes by taking water into its mouth and forcing it out through the gill passages
build	body	without a digestive system	build up	food and water		Without a digestive system all the food and water in your body would build up.
build	human	too much water	builds up	the systems shut down		If too much water builds up, the systems shut down for a human.
build	body	burns these nutrients	build	new tissues and body parts		The body then burns these nutrients for energy or uses them to build new tissues and body parts.
build	plant		builds	energy	in the foliage	Basically the plant builds it's own energy in the foliage.
build	materials or parts		make | combining			To make something by combining materials or parts.
camouflage	animals		camouflage	hide from their enemies		Some animals use camouflage to hide from their enemies.
camouflage	animals		camouflage			Most animals of the open sea use at least one of these methods to camouflage themselves.
camouflage	animals		camouflage	hide from predators		Prey animals often use camouflage to hide from predators.
camouflage	animals		camouflage			There are four basic ways animals camouflage themselves.
camouflage	animals | octopuses		camouflage		aggressive | defensive	An example of animals that uses both aggressive and defensive camouflage is octopuses.
camouflage	animals		change color | camouflage	cannot be easily seen		Animals that change color or are of a color similar to their environment can camouflage themselves so that they cannot be easily seen.
camouflage			use of any combination of materials, coloration or illumination	concealment		Camouflage is the use of any combination of materials, coloration or illumination for concealment
camouflage	animals	avoid detection by predators or prey	adaptation	blend in to their natural environments		Camouflage is an adaptation that helps many animals avoid detection by predators or prey because it allows them to blend in to their natural environments.
camouflage	species		adaptation	blend with their surroundings		Structural adaptation that enables species to blend with their surroundings
camouflage	animal	primary defense against predators	camouflage	avoid detection or recognition		A primary defense against predators throughout the animal kingdom (and against the enemy during human warfare) is to avoid detection or recognition through camouflage
camouflage	animals		change color | camouflage	cannot be easily seen		Animals that change color or are of a color similar to their environment can camouflage themselves so that they cannot be easily seen.
camouflage	animal | person | building			difficult for enemies to see		Something, that makes an animal, person, building etc. difficult for enemies to see.
camouflage			mimicking the surrounding environment	avoiding detection		Camouflage is a method of avoiding detection by mimicking the surrounding environment
camouflage	leopard		camouflage	blend in with the forest shadows		The leopard's camouflage makes it blend in with the forest shadows.
camouflage	rabbits	white fur	camouflage |use		snow	Rabbits use their white fur as camouflage in the snow.
carbon cycle				Earth capable of sustaining life		Along with the nitrogen cycle and the water cycle, the carbon cycle comprises a sequence of events that are key to making the Earth capable of sustaining life
carbon cycle	carbon					Global biogeochemical cycle which cycles carbon through biotic and abiotic components of ecosystems.
carbon cycle	carbon		movement	recycled and reused throughout the biosphere		it describes the movement of carbon as it is recycled and reused throughout the biosphere
carbon cycle	carbon		cycles	recycled and reused throughout the biosphere and all of its organisms		It is one of the most important cycles of the Earth and allows for carbon to be recycled and reused throughout the biosphere and all of its organisms
carbon cycle	carbon		carbon cycle | exchanged			The carbon cycle is the biogeochemical cycle by which carbon is exchanged among the biosphere,pedosphere, geosphere, hydrosphere, and atmosphere of the Earth
cementation	solid	heating	chemical combination	solid is changed		a process of surrounding a solid with a powder and heating the whole so that the solid is changed by chemical combination with the powder
cementation	ions		chemically precipitating	new crystalline material		Cementation involves ions carried in groundwater chemically precipitating to form new crystalline material between sedimentary grains
change	plants | animals	seasons	change			Plants and animals also change with the seasons.
change	water	energy	change the temperature			Energy can change the temperature of water .
change	water		change			The water does not change, it is still water.
change	system		change			Therefore, to change the energy of a system, energy must be transferred to or from the system.
change	energy		changes	one form to another		Here are some changes in energy from one form to another.
chemical change | chemical reaction	organism		change			A change at the molecular, atomic or subcellular level in an organism.
chemical change | chemical reaction	one or more substances		converted	other substances		A chemical reaction is a process in which one or more substances are converted into other substances.
chemical change | chemical reaction	substance		combines | synthesis | decomposes	new substance | two or more different substances		Chemical changes occur when a substance combines with another to form a new substance, called synthesis or, alternatively, decomposes into two or more different substances
chemical change | chemical reaction			chemical reactions | chemical change		products	Chemical reactions are usually characterized by a chemical change, and they yield one or more products, which usually have properties different from the reactants
chemical change | chemical reaction		heat | light | electricity	chemical reactions			Chemical reactions can be either spontaneous, requiring no input of energy, or non-spontaneous, typically following the input of some type of energy, such as heat, light or electricity
chemosynthesis	bacteria	sulfur compounds	chemosynthesis			Bacteria instead use sulfur compounds as an energy source, via chemosynthesis.
chemosynthesis	plant | organism		synthesize | photosynthesis | chemosynthesis	food		A plant is an organism that can synthesize its own food through photosynthesis or chemosynthesis.
chemosynthesis	autotrophs		produce | chemosynthesis	food		Some rare autotrophs produce food through a process called chemosynthesis, rather than through photosynthesis.
chemosynthesis			make | chemosynthesis	glucose		Photosynthesis and chemosynthesis are similar in that they both make glucose.
chemosynthesis	chemical compounds	energy	process	make food		process of using the energy in chemical compounds to make food
circulation	humans	water	circulation			Humans need water for circulation, respiration, and converting food to energy.
circulation	plants	air	circulation		dry	Plants should be given enough light and air circulation to dry in no longer than 4 hours after watering.
circulation	blood	heart's pumping | bodily vessels	movement in a circle			Movement in a circle or circuit, especially the movement of blood through bodily vessels as a result of the heart's pumping action.
circulation	water	vessels	movement | passage			Movement or passage through a system of vessels, as of water through pipes; flow.
circulation	blood	blood vascular system	movement			The movement of the blood in the blood vascular system, by which it is brought into close relations with almost every living elementary constituent.
classification | classify | classifying	surface water	cleanliness of the water	classified	different classes		Surface water is classified into five different classes depending on the cleanliness of the water.
classification | classify | classifying	plants | animals		classified			How desert plants and animals are classified.
classification | classify | classifying	energy		classified			Energy exists in different forms, all of which can be classified as either potential energy or kinetic energy.
classification | classify | classifying	energy		classified	several major groups		Forms of Energy All energy may be classified into one of several major groups.
classification | classify | classifying	The response and adaptations shown by animals to changing environment					The response and adaptations shown by animals to changing environment can be classified into two.
coloration	animal	reflection or emission of light	coloration			Animal coloration is the general appearance of an animal resulting from the reflection or emission of light from its surfaces.
coloration	object			color		Color, odor, hardness, and taste are examples of an object's properties.
coloration				visual appearance		a visual appearance with regard to color.
coloration		color	appearance			appearance with regard to color
coloration			practice of coloring			The art or practice of coloring, or the state of being colored
combustion	chemical energy		combustion | burning	heat energy		Chemical energy, the type of energy found in food and fuels, is changed into heat energy by combustion (burning).
combustion	plants in fossil fuel		combustion			Water may also be returned to the atmosphere through the combustion of plants in fossil fuel.
combustion	fossil fuels		combustion | release emissions	energy		Fossil fuels provide energy via combustion and in the process release emissions that are toxic to animals and plants.
combustion	fuel		burning	mechanical energy		An internal combustion engine is a heat engine that obtains mechanical energy from chemical energy by burning fuel.
combustion	fossil fuel		combustion	energy		In reality alternative energy means anything other than deriving energy via fossil fuel combustion.
communication	people		learn  | share | communication	information		People learn and share information through communication.
communication	organism		activity	change the behavior of other organisms		activity by one organism that changes or has the potential to change the behavior of other organisms.
communication	molecule | cell | organism	chemical or electrical signals | behaviors	transfer	information		The transfer of information from one molecule, cell, or organism to another, as by chemical or electrical signals or by behaviors.
communication	organism		exchange	information		Exchange of information between living organism.
communication	animal		transmission | reception | response			In animal behavior, a process involving transmission of, reception of, and response to signals.
composted	organic material		compost			Because compost is a completely natural and organic material,our plants would receive the best minerals with which to grow.
condensation | condense	gas		phase change	liquid		Condensation is defined as the phase change from gas (vapor) to liquid.
condensation | condense	water vapor		condensation	liquid water	in the air	condensation is the process in which water vapor in the air is changed into liquid water.
condensation | condense	water vapour		condenses	liquid water		Water vapour condenses to liquid water.
condensation | condense	water		condensed	water drops	cold glass of water	Water drops on the outside of a cold glass of water are condensed water.
condensation | condense	water vapor		condensed	water		The water in a cloud comes from water vapor in the air that has condensed.
condensation | condense	water molecules		condensed | form	liquid water		The condensed water molecules form liquid water droplets.
conduction	energy	water | air	conducting			Students should realize that water is better than air at conducting energy.
conduction	energy	materials	conduct			Some materials conduct energy better than others.
conduction	water | mineral		conduction			Root functions include water and mineral conduction, food and water storage, and anchorage.
conduction	warmed surface water		conduction	transferred downward into the water		The warmed surface water is then transferred downward into the water column by conduction and convection.
conduction	heat		direct transfer			The direct transfer of thermal motion (heat) between molecules of objects in direct contact with each other.
conservation	energy	forms change	conserved			Energy exists in many forms, and when these forms change energy is conserved.
conservation	mechanical energy	changed	law of conservation of energy	heat energy		According to the law of conservation of energy, mechanical energy can be changed to heat energy.
conservation	energy		conservation ecology | judicious use			In conservation ecology, the process of judicious use of available energy resources.
conservation	nature		conservation	protecting species, their habitats, and ecosystems from excessive rates of extinction and the erosion of biotic interactions		Conservation biology is the scientific study of the nature and status of Earth's biodiversity with the aim of protecting species, their habitats, and ecosystems from excessive rates of extinction and the erosion of biotic interactions
conservation	energy		law	remains constant over time		In physics and chemistry, the law that states that the total amount of energy in a system remains constant over time.
continental drift theory	earth's continents		continental drift | movement			Continental drift is the movement of the Earth's continents relative to each other, thus appearing to "drift" across the ocean bed.
continental drift theory		subduction	continental drift			Subduction is the main geologic force behind continental drift.
continental drift theory	continents	motion of crustal plates	lateral movement			the lateral movement of continents resulting from the motion of crustal plates.
continental drift theory	continents		movement | formation | re-formation			The movement, formation, or re-formation of continents described by the theory of plate tectonics.
continental drift theory	earth's continents		move gradually			the theory that the earth's continents move gradually over the surface of the planet on a substratum of magma.
contour plowing			contour plowing	slows the water flow | helps save precious topsoil		Contour plowing forms ridges, slows the water flow and helps save precious topsoil.
contour plowing			contour plowing			Contour plowing or contour farming or Contour bunding is the farming practice of plowing and/or planting across a slope following its elevation contour lines.
contour plowing			contour plowing | method of plowing furrows that follow the curves of the land			Contour plowing was a method of plowing furrows that follow the curves of the land rather than straight up and down slopes.
contour plowing						The water break also allows more time for the water to settle into the soil.
contour plowing	soil	slopes	tilling	prevents fertile topsoil from being carried downhill by flowing rainwater.		Tilling the soil along the gentle slopes of a piece of cropland, instead of up and down the gradient, prevents fertile topsoil from being carried downhill by flowing rainwater.
convection		movement of the air or water	convection	heat removal		The greater the movement of the air or water the greater the rate of heat removal by convection.
convection	water vapor		convection	rises		Water vapor in the air rises mostly by convection.
convection	warmed surface water		convection	transferred downward into the water column		The warmed surface water is then transferred downward into the water column by conduction and convection.
convection	water		convection	heat was transferred	from the flame of the stove	Heat was transferred from the flame of the stove to the water by convection.
convection	particles		convection	move around from one place to another	flow of thermal energy	The particles move around from one place to another through the flow of thermal energy during convection.
crop rotation		green manure | cereals	crop rotation	replenishment of nitrogen		A traditional element of crop rotation is the replenishment of nitrogen through the use of green manure in sequence with cereals and other crops
crop rotation			crop rotation	which crop to plant		Crop rotation is a systematic approach to deciding which crop to plant where in your vegetable garden from one year to the next.
crop rotation	crops		crop rotation | growing a series of dissimilar/different types			Crop rotation is the practice of growing a series of dissimilar/different types of crops in the same area in sequential seasons.
crop rotation	crops		crop rotation			In farming, 'crop rotation' is the when the same land is used to grow different crops season after season.
crop rotation	legumes		planting	restore concentrations of fixed nitrogen		The practice of planting nonlegumes one year and legumes in alternating years to restore concentrations of fixed nitrogen in the soil.
cross-pollination	plants		pollen distribution | cross-pollination	produce viable seeds		Many plants require this kind of pollen distribution, known as cross-pollination, in order to produce viable seeds.
cross-pollination	apples | fruit trees		cross-pollination between varieties	variable results		Because cross-pollination between varieties produces variable results, apples and some other fruit trees are usually not grown from seeds.
crossbreeding	species		mixing	hybrids		the act of mixing different species or varieties of animals or plants and thus to produce hybrids
crossbreeding	different breeds		mating	produce an organism		To produce an organism by the mating of individuals of different breeds,varieties, or species
crush | crushed			broken	small pieces		If something is 'crushed', it is broken into many small pieces.
crush | crushed		external weight | force	broken down	smaller compass		To be or become broken down or in, or pressed into a smaller compass, by external weight or force
crush | crushed	substance		crush	very small particles		To crush a substance to very small particles or powder.
crush | crushed	bodies		press | break | injure			To press between opposing bodies so as to break or injure.
crush | crushed	animals and plants that died millions of years ago		crushed	fossil fuel	in the earth	Fossil fuel is created by animals and plants that died millions of years ago that got crushed in the earth.
cutting	trees		cutting down	animals no longer having homes	forest	Cutting down too many trees has resulted in many forest animals no longer having homes.
