cutting	physical object	acutely directed force	separation	two or more portions		Cutting is the separation of a physical object, into two or more portions, through the application of an acutely directed force.
cutting	object	stress	cutting | compressive | shearing			Cutting is a compressive and shearing phenomenon, and occurs only when the total stress generated by the cutting implement exceeds the ultimate strength of the material of the object being cut
cutting	physical object	acutely directed force	cutting | separation	two or more portions		Cutting is the separation of a physical object, or a portion of a physical object, into two or more portions, through the application of an acutely directed force
cutting	something	chopping off	shortening			the act of shortening something by chopping off the ends
decant | decanting	mixtures	removing a layer of liquid	decantation | separation			Decantation is a process for the separation of mixtures, by removing a layer of liquid, generally one from which a precipitate has settled.
decay	animals		decomposing | decay	give off carbon dioxide	use up some oxygen	Decomposing animals still use up some oxygen and give off carbon dioxide during decay.
decay	plant		decay	carbon dioxide release		Animal …exhalations and plant decay are other sources of carbon dioxide release.
decay	dead animals		rot and decay	give off carbon dioxide	use oxygen	Dead animals continue to use oxygen and give off carbon dioxide as they rot and decay.
decay	Earth		radioactive decay | process	heat		The process by which Earth makes heat is called radioactive decay.
decay	old plants		decay	coal | fossil fuel	millions of years before	Coal is a form of fossil fuel that is formed due to decay of old plants millions of years before.
decomposition	rocks	water can form acids when it mixes with certain gases in the atmosphere	decomposition			Water can form acids when it mixes with certain gases in the atmosphere to speed up the decomposition of rocks.
decomposition	the plant	the plant dies	decomposition	carbon dioxide is given off		When the plant dies, carbon dioxide is given off from the decomposition of the plant.
decomposition	starch	bacteria and fungi	fast decomposition			Starch, which is an energy storage system for plants, undergoes fast decomposition by bacteria and fungi.
decomposition	dead plants and animals and their waste products		decomposition	soil nutrients		Another source of soil nutrients is the decomposition of dead plants and animals and their waste products.
decomposition	earth materials		chemical decomposition		at or near the earth's surface	specifically : the physical disintegration and chemical decomposition of earth materials at or near the earth's surface.
decomposition	decomposers | organisms		break down | recycle			Decomposers are living things that break down dead organisms and recycle their nutrients into the soil.
decomposition	substances		broken down	simpler form of matter		Decomposition is the process by which organic substances are broken down into a much simpler form of matter
decomposition	decomposers		process | decomposition			During the process of decomposition, the decomposers provide food for themselves by extracting chemicals from the dead bodies or organic wastes.
decomposition	animal		decompose	bones		When an animal dies and decomposes, usually only the bones remain, but even these will decompose over a much longer period of time.
decomposition	organic materials		breakdown	finished compost		the breakdown of raw organic materials to a finished compost
deposit | deposition		water slows down	deposition			deposition occurs where the water slows down.
deposit | deposition	particles	water flows over a surface	deposit		in a body of water	As water flows over a surface, it can pick up particles and deposit them in a body of water 2.
deposit | deposition	water vapor	sub freezing air	deposition	ice		Example of deposition: Change of water vapor into ice directly in sub freezing air.
deposit | deposition	fresh water	precipitation	depositing		on the planet	Precipitation is a major component of the water cycle, and is responsible for depositing the fresh water on the planet.
deposit | deposition	particles	flowing water	deposits			Flowing water erodes or deposits particles depending on how fast the water is moving and how big the particles are.
deposit | deposition	particles	stop moving	deposition			Deposition occurs when the particles stop moving.
deposit | deposition		interaction between air, water, and land	deposition			Erosion and deposition result from the interaction between air, water, and land.
deposit | deposition	sediments | soil | rocks		geological process | added		landform | land mass	Deposition is the geological process in which sediments, soil and rocks are added to a landform or land mass.
deposit | deposition	rocks | sand | sediment	forces 	deposited			Deposition is the process by which rocks, sand and sediment are deposited by the forces of erosion.
deposit | deposition	particles		settling			Deposition is the settling of particles (atoms or molecules) or sediment from a solution, suspension and mixture or vapor onto a pre-existing surface.
deposit | deposition	gas		deposition |  process	solid		Deposition is a process in which gas transforms into solid.
deposit | deposition	particles	stop moving	deposition			Deposition occurs when the particles stop moving.
deposit | deposition	air | water | land		interaction			Erosion and deposition result from the interaction between air, water, and land.
deposit | deposition	materials | rocks | stones | gravel |sand |mud		laying down			Deposition is the laying down of materials, such as rocks, stones, gravel, sand, and mud.
deposit | deposition	matter | sediments | mineral		accumulation or laying down		river | bodily organ	The accumulation or laying down of matter by a natural process, as the laying down of sediments in a river or the accumulation of mineral deposits in a bodily organ.
deposit | deposition	gas		changing | process	solid		The process of changing from a gas to a solid without passing through an intermediate liquid phase
deposit | deposition	molecules		settle out			deposition occurs when molecules settle out of a solution.
deposit | deposition	soil | rocks		geological process			Deposition is the geological process in which sediments, soil and rocks are added to a landform or land mass.
deposit | deposition	gas		phase transition | transforms	solid		a phase transition in which gas transforms into solid.
destroy			destroy			If you 'destroy' someone you hurt them badly, especially their feelings, or cause them much trouble.
destroy			destroy	make it not exist		If you 'destroy' something, you break it or make it not exist anymore.
destroy	animal		put	death		put (an animal) to death
destroy	something	damaging | attacking	put	end to the existence		put an end to the existence of (something) by damaging or attacking it.
destroy			process	cannot be repaired | no longer exists		the action or process of causing so much damage to something that it no longer exists or cannot be repaired.
diffusion	energy	objects that are in physical contact	diffusion | transfer			Conduction or diffusion The transfer of energy between objects that are in physical contact.
diffusion	water		diffusion		into the blood	the diffusion of water into the blood.
diffusion	water from the lumen		diffuses		into the blood	The water from the lumen diffuses into the blood.
diffusion	plants		diffusion	get rid of carbon dioxide and oxygen		Plants get rid of carbon dioxide and oxygen through diffusion.
diffusion	oxygen from the water		diffuses		into the capillaries in the gills	Oxygen from the water diffuses into the capillaries in the gills.
digestion | digest food	animals	eat meat or plants	digest	get energy		(food for them) And animals eat meat or plants and digest it to get energy.
digestion | digest food	our body	breaks down the food	digestive system	can use it		The digestive system breaks down the food so our body can use it.
digestion | digest food	animal proteins		digestible			Animal proteins are much more digestible than those of plant sources.
digestion | digest food	food		breaking down	nutrients		process of breaking down food into nutrients that can be absorbed by the blood
digestion | digest food	food		breaking down	molecules		the breaking down of food into molecules small enough for the body to absorb.
distillation		evaporation | condensation	distillation			The Distillation is a process of separating the component substances from a liquid mixture by selective evaporation and condensation.
distillation	liquid	heating | cooling	purifying			the action of purifying a liquid by a process of heating and cooling.
dripping	condensed water		dripping off their chilled drink glass	onto their coffee tables		People buy coasters to keep condensed water from dripping off their chilled drink glass onto their coffee tables.
driving		force | compulsion	send | expel	move		to send, expel, or otherwise cause to move by force or compulsion
driving	vehicle | animal		movement			to cause and guide the movement of (a vehicle, an animal).
driving			driving			The Driving is the controlled operation and movement of a land vehicle, such as a car, truck or bus
driving			operating a motor vehicle			In particular, the action of operating a motor vehicle.
driving	vehicle | animal		controlling | steering			the act of controlling and steering the movement of a vehicle or animal
drop | dropping			swift decline | decrease			A swift decline or decrease, as in quality, quantity, or intensity.
drop | dropping			fall			let or make (something) fall vertically.
drop | dropping			become less			To become less, as in number, intensity, or volume.
drop | dropping			cease			To cease consideration or treatment of
drop | dropping			fall	from a higher to a lower place		To fall from a higher to a lower place or position.
eclipse	moon	passes between Earth and Sun	eclipse of the sun			An eclipse of the Sun can only occur at New Moon when the Moon passes between Earth and Sun.
eclipse	earth	is in between the sun and moon	lunar eclipse			a lunar eclipse is when the earth is in between the sun and moon.
eclipse	moon	is between the sun and the earth	solar eclipse			A solar eclipse is when the moon is between the sun and the earth.
eclipse	moon		astronomical alignment	shadow		An astronomical alignment in which a planetary object (for example, the Moon) comes between the Sun and another planetary object (for example, the Earth), resulting in a shadow being cast by the middle object onto the other object.
eclipse	celestial body		obscuring			The partial or complete obscuring, relative to a designated observer, of one celestial body by another.
eliminate waste | eliminating waste	animals		eliminate waste			All animals grow, take in nutrients, breathe, reproduce, eliminate waste, and die.
eliminate waste | eliminating waste			eliminate wastes			It is also needed to carry other nutrients, to regulate body temperature, and to help eliminate wastes.
eliminate waste | eliminating waste			getting rid			It is the process of getting rid of waste material.
eliminate waste | eliminating waste	animals		passing food			All animals get rid of this solid waste after passing food through their digestive system.
eliminate waste | eliminating waste	body		leaves	feces		The waste leaves the body in the form of feces.
eliminate waste | eliminating waste	animals	mouth | nose	exhaling | get rid	carbon dioxide |gaseous waste		Animals get rid of their gaseous waste by exhaling carbon dioxide through their mouth and nose.
eliminate waste | eliminating waste	plants	through their roots	get rid of chemical waste			Plants get rid of chemical waste through their roots.
eliminate waste | eliminating waste	plants	through their leaves	get rid of gaseous waste	oxygen		Plants get rid of gaseous waste through their leaves in the form of oxygen.
energy	plants	make their own food	energy			Plants make their own food for energy.
energy	animals	eating plants or other animals which eat plants	get their energy			Animals get their energy from eating plants or other animals which eat plants.
energy	animal	eat plants	use that food energy			Animal eat plants to use that food energy.
erosion	the banks	water flow	eroding			Water flow kept eroding the banks over an incredibly long period of time.
erosion	cold air	warm air	gradually erodes			The warm air gradually erodes the cold air.
erosion	material	the sea	eroded			The sea transports the material it has eroded and deposits it in places where the water is calm.
erosion	particles	flowing water	erodes			Flowing water erodes or deposits particles depending on how fast the water is moving and how big the particles are.
erosion	soil | materials		process	moved from one place to another		Erosion is the process by which soil and or other Earth materials are moved from one place to another.
erosion	sand	wave action		movement		movement of sand along a beach by wave action
erosion	pieces		moving	from one location to another		Erosion involves moving pieces from one location to another.
erosion	soil | rock 	wind | water |ice	process| removed	transported elsewhere		The process by which soil and rock is removed from one area of the Earth through natural causes such as wind, water, and ice and transported elsewhere is called erosion.
erosion	soil | rock		exogenic processes	transport it to another location		erosion is the action of exogenic processes (such as water flow or wind) which remove soil and rock from one location on the Earth's crust, then transport it to another location where it is deposited.
eruptions	magma and associated gases and ash	a vent in the surface of the EArth	erupt			A vent in the surface of the Earth through which magma and associated gases and ash erupt.
eruptions	hot liquid rock | lava		erupted		onto the surface of the Earth	Hot liquid rock erupted onto the surface of the Earth is known as lava.
eruptions			eruptions	gases		Gases from eruptions can keep sunlight from reaching the earth and darken the sky for years.
eruptions	molten rock		volcanic eruptions		occurs at the surface of the Earth	Molten rock that occurs at the surface of Earth, usually through volcanic eruptions.
eruptions	volcanoes		erupt	igneous rocks | magma to rise above the earth's surface		Igneous rocks are also formed when volcanoes erupt, causing the magma to rise above the earth's surface.
evaporate | evaporation	water		evaporation	clouds		Clouds get their water from evaporation.
evaporate | evaporation	oils		evaporate 			Essential oils evaporate readily and are easily damaged by light, extremes of temperature and prolonged exposure to oxygen in the air.
evaporate | evaporation	moisture		evaporation | extracting			evaporation - the process of extracting moisture
evaporate | evaporation	matter		evaporation | changes	one state to another		Evaporation and condensation are two processes through which matter changes from one state to another.
evaporate | evaporation	water | liquid state		evaporation | changing	gaseous state | vapor		Evaporation involves changing water from its liquid state to a gaseous state (vapor)
evaporate | evaporation	liquid		evaporation | vaporization	gaseous phase	surface of a liquid	Evaporation is a type of vaporization of a liquid that occurs from the surface of a liquid into a gaseous phase that is not saturated with the evaporating substance.
evaporate | evaporation	substance | liquid state	increase in temperature and/or pressure	process | changing | evaporation	gaseous state		Evaporation is the process of a substance in a liquid state changing to a gaseous state due to an increase in temperature and/or pressure.
evaporate | evaporation	matter | liquid		evaporation | changes	gas		In evaporation, matter changes from a liquid to a gas.
evaporate | evaporation	liquid water		changing | evaporation	water vapor		Liquid water changing to water vapor is evaporation.
evaporate | evaporation	surface water	energy of the sun	evaporated		from the earth	Surface water is evaporated from the earth by the energy of the sun.
evaporate | evaporation	liquid	temperature below the boiling point	change	vapor		The change of a liquid into a vapor at a temperature below the boiling point.
evaporate | evaporation	water		change of state | evaporation	water vapor		The change of state from water to water vapor is called evaporation.
evaporate | evaporation	liquid	heat	changing	gas		The changing of a liquid into a gas, often under the influence of heat (as in the boiling of water).
evaporate | evaporation	liquid water	energy from the sun	change | evaporate	water vapor		The energy from the sun heated the water and caused it to evaporate - change from liquid water to water vapor.
evaporate | evaporation	liquid water		process | evaporation | changing	water vapor		The process of liquid water changing into water vapor is called evaporation.
evaporate | evaporation	water		evaporated	water vapor	in the air	The water evaporated back into water vapor in the air.
evaporate | evaporation	water		evaporates	water vapor	into the air	Water evaporates as water vapor into the air.
evaporate | evaporation	water		evaporation		the atmosphere	Water from the oceans enters the atmosphere through evaporation.
evolution	plants	water transport mechanisms | waterproof cuticles	evolved	survive without being continually covered by a film of water		As water transport mechanisms, and waterproof cuticles, evolved, plants could survive without being continually covered by a film of water.
evolution	humans		evolved	eating both animals and plants		Humans evolved eating both animals and plants.
evolution	plants		evolved	reproductive strategies that involve animals		Many plants have evolved reproductive strategies that involve animals.
evolution	desert animals		evolved	mechanisms | retain water		The mechanisms some desert animals have evolved to retain water are even more elaborate.
evolution	individuals	natural selection	change	new species		Change in the genetic composition of a population during successive generations, as a result of natural selection acting on the genetic variation among individuals, and resulting in the development of new species.
explain	something		make	comprehensible		to make (something) comprehensible, esp by giving a clear and detailed account of the relevant structure, operation, surrounding circumstances
explain	professor		explain		diagram	The professor used a diagram to explain the theory of continental drift.
explain	statements		clarifies | consequences	a set of facts		a set of statements constructed to describe a set of facts which clarifies the causes, context, and consequences of those facts.
explain	somebody			understand		If you 'explain' something, you talk about it so that somebody can understand it.
explain			make plain or comprehensible			To make plain or comprehensible.
explode | explodes			explodes	breaks		If something explodes, it breaks apart quickly and strongly.
explode | explodes	human population	free energy	explode	worsening the current problem of over-population		Free energy will only cause the human population to explode even more rapidly, worsening the current problem of over-population.
explode | explodes	plants	flinging the seeds away from the parent plant	explode	distribute their seed		Some plants distribute their seed when their seedpods explode, flinging the seeds away from the parent plant.
explode | explodes	seeds		method | exploding			Also seeds can use the method bursting or exploding.
explode | explodes	seed pod		explodes open | ballistic/mechanical dispersal	flings its seeds away from the mother plant		There is also ballistic/mechanical dispersal, where a seed pod explodes open and flings its seeds away from the mother plant.
extinction		water	fire extinction	fighting wildfires		Fire extinction Water is used for fighting wildfires.
extinction	animals	not being able to survive in a changing environment	natural extinction			Natural extinction occurs due to animals not being able to survive in a changing environment.
extinction	ancient animals	environments they live in have changed | there was increased competition	extinct			Ancient animals have become extinct because the environments they live in have changed, or there was increased competition.
extinction	animals		extinct			Animal life cycles All animals need to reproduce or they will become extinct.
extinction	living organism | plant | animal		ceasing to exist | species died			The ceasing to exist of a species of living organism, such as a plant or animal, whose numbers declined to the point where the last member of the species died and therefore no new members of the species could ever again be born.
fall			move downward	from a higher to a lower level	rapidly and freely without control	move downward, typically rapidly and freely without control, from a higher to a lower level.
fall	object	the force | gravitational attraction	fall	back down to earth's surface		If an object is thrown into the air, the force used will only allow it to travel a certain distance before the gravitational attraction between the object and the Earth causes it to fall back down to Earth's surface.
fall	liquid water	rain	falling		sky	Rain is liquid water falling from the sky.
fall		force of gravity	descend freely			to descend freely by the force of gravity
fall	something | someone		falls			When something or someone falls, it moves down quickly down through the air because nothing is holding it
Feel sleepy				sleep		Ready for or needing sleep
Feel sleepy			inducing	sleep		To Inducing sleep
fertilization	plants	animals poop	fertilize			animals eat plants, animals poop and fertilize plants.
fertilization	plants		fertilize			Water and fertilize your plants as needed.
fertilization	plants		fertilize | self-fertilization			Plants can fertilize themselves: called self-fertilization.
fertilization			fertilizer | process			The act or process of applying a fertilizer.
fertilization		insemination | pollination	biological reproduction			The act or process of initiating biological reproduction by insemination or pollination.
filtering	water	with a bandana or other piece of material	pre-filter			To Pre-filter the water with a bandana or other piece of material.
filtering	plants		filter the air	human beings and animals to survive		Plants filter the air in order for human beings and animals to survive.
forecast	weather	Changes in pressure	forecasting | predict			Changes in pressure are used to predict imminent weather changes, so barometers are useful tools for weather forecasting.
forecast			forecasts			Pressure is Measured Meteorologists use a number of tools to gauge weather changes and to create forecasts.
forecast	Weather		forecasters			Weather forecasters look at the relative change at different places, taking into account how air pressure changes with elevation.
forecast		winds | barometer	forecasts			Using winds and a barometer to make forecasts.
forecast			forecasts			weather How Atmospheric Pressure is Measured Meteorologists use a number of tools to gauge weather changes and to create forecasts.
freeze | freezing	water		changing | freezing	ice		Liquid water changing to ice is called freezing.
freeze | freezing	liquid	loss of heat	pass	solid		To pass from the liquid to the solid state by loss of heat.
freeze | freezing	liquid	temperature is lowered	phase transition | freezing | solidification	solid		Freezing, or solidification, is a phase transition in which a liquid turns into a solid when its temperature is lowered below its freezing point.
freeze | freezing			become hardened	ice | solid body		to become hardened into ice or into a solid body
freeze | freezing	Salt water	lower temperature	freeze			Salt water needs a lower temperature to freeze than pure water.
freeze | freezing	water		freeze			Running water does not freeze as easily as water that is not moving.
freeze | freezing	water		changed | freezing	solid ice		The water has changed from liquid water to solid ice through the process of freezing.
freeze | freezing	water		freezes | it expands			because some rocks absorb water and when water freezes it expands.
freeze | freezing	water vapour or liquid water		freeze	Water as Ice		Water as Ice Ice occurs when water vapour or liquid water freeze.
friction	mechanical waves	move	friction	energy is lost		all mechanical waves must lose energy as they move through a medium because some energy is lost due to friction.
friction		lack of water	friction			An excess of water creates too much suction, whereas a lack of water will create friction.
friction	kinetic energy		friction	converted to heat		Due to friction, kinetic energy is converted to heat and not potential energy.
friction	box		pushing	moves		Part of the energy of your pushing moves the box, and part of the energy is lost to kinetic friction.
friction			friction			In converting one form of energy into another, some energy is ordinarily wasted in overcoming friction.
friction	surfaces	force	resistance			Friction is a force that provides resistance whenever two surfaces are in contact.
friction	box	force	friction	stop		The box pushed across the floor will eventually stop because of the force, or friction, the floor has on the box.
friction	bicycle | car	brakes	force exerted	stop		Friction is also the force exerted by brakes on a bicycle or car in order to stop.
friction	objects		slide over one another			When two objects slide over one another friction can occur.
friction	solid surfaces | fluid layers | material elements	force	resisting | sliding against each other			Friction is the force resisting the relative motion of solid surfaces, fluid layers, and material elements sliding against each other.
germinating | germination	seeds	water	germinated			The seeds of the water lily can be dispersed and germinated in the water.
