reproduce | reproduction | reproducing			reproduces	plant		In late summer this final generation reproduces sexually and lays eggs on the branches of the witch hazel plant.
reproduce | reproduction | reproducing	plants		reproduce			Like many other plants , most trees reproduce from seed.
reproduce | reproduction | reproducing	plants		reproduce			Invasive plants reproduce rapidly , either vegetatively or by seed.
reproduce | reproduction | reproducing	plants		reproduce			Section rhizomes on individual plants to reproduce more plants.
reproduce | reproduction | reproducing	plants		reproduce			The Bible tells us that God designed procreation so that plants , animals , and humans always reproduce after their own kind or seed.
reproduce | reproduction | reproducing	Plants		reproduce			Plants and animals reproduce.
reproduce | reproduction | reproducing	Plants		reproduce			Plants can reproduce one of two ways , sexually or asexually.
reproduce | reproduction | reproducing	plants		reproduce	plant		The beetles dispatched to handle the plant will need time to do the work , reproduce and head out to other plants , Blossey said.
reproduce | reproduction | reproducing	Plants	stamen and pistil	reproduce			Plants reproduce through stamen and pistil.
reproduce | reproduction | reproducing	plants	making seeds	reproduce			For example , many plants reproduce by making seeds.
reproduce | reproduction | reproducing	plants		reproduce			It 's rapid over-shadowing growth makes it difficult for native Hawaiian forest plants to reproduce themselves.
reproduce | reproduction | reproducing	plants		reproduce			Many plants can not even reproduce without animals.
reproduce | reproduction | reproducing	plants		reproduce			Some plants such as Ceratophyllum or Coontail reproduce utilizing unique structures called winter buds.
reproduce | reproduction | reproducing	plants		reproduce			Water temperature affects when animals and plants feed , reproduce , and migrate.
reproduce | reproduction | reproducing	plants		reproduce			There are a variety of ways plants reproduce themselves.
reproduce | reproduction | reproducing	plants		reproduce			At the same time , the plants reproduce and spread out trying to balance this little virtual habitat.
reproduce | reproduction | reproducing	plants		reproduce			Healthy ponds plants reproduce rapidly and it 's great to have a reference for dividing and repotting them.
reproduce | reproduction | reproducing	plants		reproduce			Without fire some plants can not even reproduce.
reproduce | reproduction | reproducing			reproduce	plant		They can reproduce in two basic ways : asexually and sexually -- in fact , the same plant species often employs both strategies.
reproduce | reproduction | reproducing	plants		reproduce			Without moisture , the plants physiologically could not reproduce.
reproduce | reproduction | reproducing	plants		reproduced			Some plants can not be easily or economically reproduced asexually.
reproduce | reproduction | reproducing	plants		reproduce	plant		Some plants reproduce both asexually and sexually , and both types of reproduction have certain advantages from the plant standpoint.
reproduce | reproduction | reproducing	plants		reproduce			Some root-knot nematodes have developed the ability to reproduce on plants with Mi.
reproduce | reproduction | reproducing	plants		reproduce			Animals reproduce animals , plants reproduce plants , human beings reproduce human beings , and attributes reproduce attributes.
reproduce | reproduction | reproducing	Plants		reproduce			Vegetative Propagation - Plants can reproduce in two ways.
reproduce | reproduction | reproducing	plants		reproduce			Some species reproduce both asexually and sexually , including yeast and plants.
reproduce | reproduction | reproducing			reproduce	plant		It does help the plant Itsaplantdarnit reproduce.
reproduce | reproduction | reproducing			reproduce	plant		Under conditions of high humidity , the bacteria reproduce quickly , spreading to healthy parts of the plant.
reproduce | reproduction | reproducing			reproduce	plant		Plans for the recovery of the cactus are focusing on the development of techniques to reproduce the plant in a greenhouse.
reproduce | reproduction | reproducing			reproduce	plant		`` They do not reproduce the parent plant , and the seeds must be purchased each year from the company hybridizing them.
reproduce | reproduction | reproducing		seed , crown buds and roots	reproduce	plant		The plant can reproduce by seed , crown buds , and roots.
reproduce | reproduction | reproducing		budding every 30 hours	reproduce	plant		Under ideal conditions a single plant of the Indian species Wolffia microscopica may reproduce vegetatively by budding every 30 hours.
reproduce | reproduction | reproducing			reproduce	plant		Human beings plant trees , but trees also reproduce themselves.
reproduce | reproduction | reproducing			reproduce	plant		Most crops are living organisms which are able to reproduce a plant.
reproduce | reproduction | reproducing			reproduce	plant		So now the trick is to reproduce the plant 's flower scents artificially.
reproduce | reproduction | reproducing			reproduce	plant		It is illegal to asexually reproduce a patented plant , even for personal use.
reproduce | reproduction | reproducing			reproduce	plant		Reduced pollination and movement of floral gametes necessary to reproduce plant populations.
reproduce | reproduction | reproducing			reproducing	plant		However the plant has been vegetatively reproducing itself for 43 600 years.
reproduce | reproduction | reproducing			reproduce	plant		They can be difficult to detect and identify because they only survive and reproduce in living plant tissue.
reproduce | reproduction | reproducing			reproduce	plant		Fastidious bacteria and mycoplasmas reproduce much slower than bacteria and are usually in lower numbers in the plant.
reproduce | reproduction | reproducing			reproduce	plant		They reproduce for as long as they are alive and plant matter is available.
reproduce | reproduction | reproducing			reproduce	plant		If you pick the &#8220; fruit &#8221; then the seeds will not end up on the ground and the plant can not reproduce.
reproduce | reproduction | reproducing			reproduce	plant		Bees and wasps help the black lace cactus reproduce by spreading pollen from plant to plant.
reproduce | reproduction | reproducing		spreading pollen from plant to	reproduce	plant		At night moths help this plant reproduce by spreading pollen from plant to plant.
reproduce | reproduction | reproducing			reproduce	plant		The more you understand the ecology of the site the closer you can reproduce a viable plant community on the site.
reproduce | reproduction | reproducing		taking a part of	reproduce	plant		On the contrary , we help the plant reproduce by taking a part of it which was designed to be attractive , to spread its seeds.
reproduce | reproduction | reproducing			reproduce	plant		Humans plant trees , but trees also reproduce themselves.
reproduce | reproduction | reproducing			reproduce	plant		It is illegal to assexually reproduce a patented plant , even for personal use.
reproduce | reproduction | reproducing			reproduce	plant		To reproduce individual organisms asexually , as in plant propagation through budding or layering.
reproduce | reproduction | reproducing			reproduce	plant		Nematodes reproduce in the vascular system of the plant , reducing the flow of water and nutrients.
reproduce | reproduction | reproducing			reproduce	plant		Creeping perennials reproduce by seed or plant parts.
reproduce | reproduction | reproducing			reproduce	plant		Nor is it intended to reproduce all features unique to your plant.
reproduce | reproduction | reproducing			reproduce	plant		In order to determine the pathogen or to reproduce it a segment of diseased plant is inserted in the medium.
reproduce | reproduction | reproducing			reproduce	plant		The only way to faithfully reproduce a particular plant is to make a copy of it ( a clone ) by vegetative means.
reproduce | reproduction | reproducing	plants		reproduce	plant		Hybrids are wonderful plants but the seed is often sterile or does not reproduce true to the parent plant.
reproduce | reproduction | reproducing			reproduce	plant		Illsley also plans to establish nurseries to reproduce agave and return the plant to the forest.
reproduce | reproduction | reproducing			reproduce	plant		Herbals were books similar in style to Dioscorides ' work but made use of woodcuts to reproduce the plant images.
reproduce | reproduction | reproducing		fragmentation	reproduce	plant		This plant can reproduce by fragmentation.
reproduce | reproduction | reproducing			reproduce	plant		Trout , other than lake trout , do n't reproduce in lakes , so you either plant them or do without.
reproduce | reproduction | reproducing			reproduce	plant		In the process , they pollinate the flowers and ensure that the plant species will in turn reproduce.
reproduce | reproduction | reproducing			reproduce	plant		Without the moth , the plant can not reproduce variation or disperse ; given any major climate changes , it too will go extinct.
reproduce | reproduction | reproducing	plants	producing seeds	reproduce			Some plants reproduce by producing seeds.
reproduce | reproduction | reproducing			reproduce	plant		Diatoms reproduce by binary fission , which means that a plant splits into two halves , each half becoming a new diatom.
reproduce | reproduction | reproducing	plants	cross-pollination	reproduce			Waterhemp plants are either male or female , and thus reproduce entirely through cross-pollination.
reproduce | reproduction | reproducing	plants		Reproduce			Reproduce plants using either an asexual or a sexual method of propagation.
reproduce | reproduction | reproducing			reproduce	plant		Some plant species , including giant sequoias , reproduce better after fire.
reproduce | reproduction | reproducing	plants		reproduce			Bulbs Top of Page Many plants and flowers reproduce from bulbs.
reproduce | reproduction | reproducing	Plants		reproduce	plant		Non-Flowering Plants , by Shuttleworth and Zim More than 100,000 plant species reproduce without bearing flowers.
reproduce | reproduction | reproducing			reproduce	plant		Once inside the plant , the bacteria reproduce rapidly and move through the vascular system , congesting and killing tissue.
reproduce | reproduction | reproducing			reproduce	plant		It is an infringing act to reproduce , sexually or asexually , a plant variety that is protected by utility patent.
reproduce | reproduction | reproducing	plants		reproduce	Plant		Plant Life ( Botany ) Develop a knowledge of the function of plant parts and how plants reproduce themselves.
reproduce | reproduction | reproducing	plants	seeds or spores	reproduce	Plant		Life Sciences - Plant Reproduction Vascular plants may reproduce by seeds or spores.
reproduce | reproduction | reproducing	plants	spores	reproduce			Non-vascular plants such as moss reproduce by spores.
reproduce | reproduction | reproducing			reproduce	plant		In warmer countries like South Africa this plant can reproduce very fast in rivers dams and waterways clogging them with this weed.
reproduce | reproduction | reproducing			reproduce	plant		Students will reproduce detailed embankment contours , features and plant life maps on graph paper.
reproduce | reproduction | reproducing			reproduce	plant		These introduced pests completely destroy the flowers so the plant can not reproduce.
reproduce | reproduction | reproducing			reproduce	plant		The plant can reproduce vegetatively , by rhizomes , and by producing seeds , which drop near the parent plant.
reproduce | reproduction | reproducing	plants		reproduce			Pollen is tiny particles that help many plants reproduce.
reproduce | reproduction | reproducing		energy	reproduce			Wherever possible , resources which can reproduce themselves and utilize the sun 's energy are used.
reproduce | reproduction | reproducing		dropping pollen when an animal brushes	reproduce	plant		Evidently the plant reproduce by dropping pollen when an animal brushes it.
reproduce | reproduction | reproducing			reproduce	plant		Trees will reproduce naturally much faster than people can plant clones , he says.
reproduce | reproduction | reproducing			reproduce	plant		When prey is scarce , they can survive and reproduce on a diet of pollen , fungi and plant fluids.
reproduce | reproduction | reproducing			reproduce	Plant		Plant lice reproduce rapidly and have a short life cycle.
reproduce | reproduction | reproducing			reproduce	plant		Zoospores from the vegetative cells reproduce the plant asexually , as can fragmentation of the filaments.
reproduce | reproduction | reproducing			reproduce	Plant		Permission to reproduce this material granted by the American Society of Plant Physiologists.
reproduce | reproduction | reproducing	plants		reproduce	plant		You will have an opportunity to study how plants reproduce , grow , photosynthesise , and then move carbohydrate around the plant.
reproduce | reproduction | reproducing			reproduce	plant		These seeds when sown will reproduce exactly the same plant the following year.
reproduce | reproduction | reproducing			reproduce	plant		What 's more , plant species can reproduce sexually , or asexually , or both.
reproduce | reproduction | reproducing		simply	reproduce	plant		Gemmae are cells that will reproduce another entire plant simply by cell reproduction on fertile substrate.
reproduce | reproduction | reproducing			reproduce	plant		The simulators reproduce actual plant conditions in order to train the nuclear power plant operators.
reproduce | reproduction | reproducing	plants	seed	reproduce	Plant		back to the index In the Plant Kingdom , two groups of plants reproduce by seed : Gymnosperms and Angiosperms.
reproduce | reproduction | reproducing	plants		reproduce	plant		`` Flowers give nectar , and in exchange the butterflies help plants reproduce by carrying pollen from one plant to another.
reproduce | reproduction | reproducing			reproduce	plant		( 7 ) `` Cultivation or culture '' means to grow or cause to reproduce any aquatic plant.
reproduce | reproduction | reproducing	plants		reproduce	plant		You will also discover some methods and special plant organs by which plants can reproduce asexually.
reproduce | reproduction | reproducing	plants		reproduce	plant		Pollen must be carried from plant to plant in order for some plants to reproduce -- a process called pollination.
reproduce | reproduction | reproducing	Plants		reproduce			CE/Concept Fb : Plants reproduce and grow in various ways.
reproduce | reproduction | reproducing	plants	seeds	reproduce			Pines reproduce with seeds , just like flowering plants , but the seeds are borne in cones instead of flowers and fruits.
reproduce | reproduction | reproducing		spores , which are the equivelent of	reproduce	plant		Fungi reproduce through spores , which are the equivelent of a plant 's seeds.
reproduce | reproduction | reproducing	plants		reproduce			Many cultivated garden plants reproduce more efficiently from roots , stems , and leaves than from seeds.
reproduce | reproduction | reproducing			reproduce	plant		Now that the plant has reproductive parts it is now time for the plant to reproduce.
reproduce | reproduction | reproducing			reproduce	Plant		Type of Plant Upright blackberries and a few purple raspberries reproduce from suckers , as do red raspberries.
reproduce | reproduction | reproducing			reproduce	plant		Flowers are more than beautiful structures that appeal to humans : they exist so the plant can reproduce itself.
reproduce | reproduction | reproducing	plants		reproduce	plant		Digging , cutting , chopping or turning the soil when you have plants with this type of root system only helps the plant reproduce.
reproduce | reproduction | reproducing			reproduce	Plant		Plant or animal species that utilize this strategy reproduce rapidly and tend to be small and mobile.
reproduce | reproduction | reproducing			reproduce	plant		During the second season , a new plant grows from the root and develops flowers that set seed to reproduce the plant.
reproduce | reproduction | reproducing	plants		reproduce			Chlamydospores of Fusarium can germinate and reproduce near seed and roots of many nonhost plants as well as organic matter.
reproduce | reproduction | reproducing	their own kind		reproduce	plant		You have faith that , when you plant seeds , they will reproduce of their own kind.
reproduce | reproduction | reproducing	plants		reproduce	plant		These insects , as well as other animals like birds and bats , help plants reproduce by transferring pollen from one plant to another.
reproduce | reproduction | reproducing		rapidly	reproduce	plant		However , milfoil is able to reproduce very successfully and rapidly through the formation of plant fragments.
reproduce | reproduction | reproducing			reproduce	plant		to reproduce ( itself ) ; multiply : said of a plant or animal.
reproduce | reproduction | reproducing		rhizomes	reproduce	plant		The plant can reproduce vegetatively by rhizomes and produces seeds that drop near the parent plant.
reproduce | reproduction | reproducing	Plants		reproduce			CE/TN Concept Fb : Plants reproduce and grow in various ways.
reproduce | reproduction | reproducing			reproduce	plant		By propagating asexually ( cloning ) , we reproduce the `` mother '' plant.
reproduce | reproduction | reproducing		energy	reproduce			`` We 're really trying to reproduce the energy source of the universe , '' Barnard said.
reproduce | reproduction | reproducing		energy	reproduce			On stage , they reproduce their techno-flavoured-metal sound with energy and enthusiasm.
reproduce | reproduction | reproducing		energy	reproduce			It has to be carrying a memory molecule that tells it how to reproduce itself and also how to get energy.
reproduce | reproduction | reproducing		energy	reproduce			Agents having hight energy can reproduce themselves and others having low energy may die.
reproduce | reproduction | reproducing		energy	reproduce			In the similar way to fish search , agents reproduce themselves or die dependingand others having low energy may die.
reproduce | reproduction | reproducing		energy	reproduce			In order for the energy analysis to correctly reproduce the total energy , we must ensure that the charge of nitrogen is.
reproduce | reproduction | reproducing		energy	reproduce			Perhaps the new theories indicate that the clays actually reproduce , somehow using energy to feed off the `` parent '' rock.
reproduce | reproduction | reproducing		energy	reproduce			We know that no engine that is able to reproduce in full effect a whole burnt energy ( fire ) of used gasoline exists.
reproduce | reproduction | reproducing		energy	reproduce			It will be of interest to see how well theory can reproduce the isomer preference energy.
reproduce | reproduction | reproducing		energy	reproduce			Be able to reproduce graph a ) If energy of products lower than reactants -- > exergonic rxn.
reproduce | reproduction | reproducing	plants		reproduce			Bacteriologist study how bacteria infect humans , animals and plants , reproduce and cause disease.
reproduce | reproduction | reproducing		energy	reproduce			When a negative energy takes form , to maintain , reproduce , and expand itself.
reproduce | reproduction | reproducing		energy	reproduce			Explain how , with no nucleus or membrane-bound organelles , monerans reproduce themselves and obtain energy to carry on metabolism.
reproduce | reproduction | reproducing		energy	reproduce			( Correct Spelling Counts ) digest hunt living first Amoeba reproduce eliminate simplest energy microscope.
reproduce | reproduction | reproducing		energy	reproduce			However , if the energy resolution is strongly energy dependent , the measured spectra do not reproduce the true spectra.
reproduce | reproduction | reproducing		energy	reproduce			The claim that Mills 's theory can correctly reproduce the known energy levels of hydrogen is completely without merit.
reproduce | reproduction | reproducing		energy	reproduce			Refined waveform and randomized frequencies to more closely reproduce the Qi vital energy generated by Qi Gong Masters-Practitioners.
reproduce | reproduction | reproducing		energy	reproduce			These calculations can not reproduce the energy and angle dependence of the data.
reproduce | reproduction | reproducing		energy	reproduce			Being efficient at reproduction means living long enough to reproduce , which means making efficient use of energy.
reproduce | reproduction | reproducing		energy	reproduce			Agents can only reproduce with enough energy.
reproduce | reproduction | reproducing		energy	reproduce			Not even the best printed version can reproduce the beauty , elegance , force and energy of his handwriting.
reproduce | reproduction | reproducing		energy	reproduce			It can reproduce itself , use energy and adapt to its environment , after all.
reproduce | reproduction | reproducing		energy	reproduce			We did n't have to reproduce our energy , which is what usually happens when you work with a big outside producer.
reproduce | reproduction | reproducing		energy	reproduce			In addition , the productive season is short , which means that there is limited time to reproduce and to gather stores of energy.
reproduce | reproduction | reproducing		energy	reproduce			In addition we try to reproduce the neutrino energy spectrum recently determined by Super-Kamiokande.
reproduce | reproduction | reproducing		energy	reproduce			`` They reproduce themselves , make copies , move around , evolve , consume energy when they run.
reproduce | reproduction | reproducing		energy	reproduce			If Chestnut Station can even reproduce energy half this powerful on Saturday night , watch out , Malkmus.
reproduce | reproduction | reproducing		energy	reproduce			Traditional loudspeaker design calls for three components to reproduce sound energy : woofers , tweeters and midrange drivers.
reproduce | reproduction | reproducing		energy	reproduce			Now to reproduce they need energy and sustain its body.
reproduce | reproduction | reproducing	plants		reproduce			Trees and other plants reproduce themselves , to be sure.
reproduce | reproduction | reproducing		energy	reproduce			Lamp manufacturers often aim to make fluorescent lamps which reproduce this distribution in the energy they emit.
make food	plants		processes			It continues with the most advanced wire - manufacturing processes you 're likely to encounter anywhere - including your own plants.
make food	plants		process			Now you can cut years off the process of learning about plants and their uses.
make food	plants		process			The system can be used for simulating growth process of several kinds of plants.
make food	plants		process			Describe the process of genetically modifying plants.
make food	Plants		process			Your Task Your task is to balance the elements involved in the process of photosynthesis Materials Plants , sunlight , soil and water.
make food	plants		process			Existing plants that are already licensed will often process poultry and rabbits for additional income.
make food	plants		process	the atmosphere		Transpiration : a process by which living plants give off water vapor into the atmosphere.
make food	plants		Process	energy		Process evaluation of apparatus and technological plants in sugar factories with goal to calculate mass and energy balance.
make food	plants		Process			Process by which human beings rear animals and plants with particular traits that an organism will pass on to offspring.
make food	plants		process			Scientists have endeavored to understand development of pollen and the process of fertilization in maize and other plants.
make food	plants		process			Also , cloning is a natural biological process for many organisms such as certain microbes and plants.
make food	plants		process			The process when plants make their food.
make food	plants		process			The process of cataloging plants based on a heat zone designation is just beginning.
make food	plants		Process			Process streams at cement plants are substantially more uniform based on the cement production requirements and methods.
make food	plants		process			Cement kiln dust is a byproduct of the cement manufacturing process generated by most cement plants.
make food	plants		process			This process , conducted at all G-P Gypsum plants , means the board could contain as much as 8 to 10 % recycled gypsum.
make food			process			The controversial food engineering process has been the center of an ongoing agricultural debate.
make food			process	energy		Solar energy is needed by green plants for the process of photosynthesis , which is the ultimate source of all food.
make food	plants	which	process	energy		Primary productivity is the process by which plants trap energy from the sun and turn it into food and materials.
make food	plants		process			Photosynthesis is the process that plants use to combine sunlight , water , and carbon dioxide to create food.
make food	plants		process			Today , the &#145; stripping &#146; process used in all modern plants separates the corrosive ammonium carbamate from the urea.
make food	plants		process			These enzymes could play a role in the increased lignification process observed in treated plants.
make food	plants		process			`` But that is a two-to-four year process to get all those plants on line.
make food	plants		process			It also designs and constructs specialty process , pharmaceutical and biotechnology plants.
make food	plants		process			The mushroom is a certain type of fungus , but the shroom tree has a process of feeding much like the plants on our planet.
make food	plants		process			Ethylene is a naturally occurring , gaseous plant hormone that speeds up the aging process of plants exposed to it.
