plant | planting		chosen combination	putting	4 tablespoons of your seed seeds in mouth jar		You can do this buy putting 1 to 4 tablespoons of your chosen seed or a combination of a few seeds in a wide mouth jar.
plant | planting			Putting			Putting your seeds in the freezer for a few days can improve germination.
plant | planting			putting			It does not mean simply putting the dry seeds in the refrigerator.
plant | planting			putting			`` Do n't know , '' replied the waiter , `` but they 're putting the seeds in their pockets.
plant | planting			putting			Seeds For Sale Since 1980 Rosemary Steele has been putting out a list of seeds for sale , updated and changed every autumn.
plant | planting			putting			Nothing made him happier than putting in seeds , tending them and harvesting the crops.
plant | planting			putting			We think that planting a new fund is like putting squash seeds in the ground in December.
plant | planting			putting			`` She would always sing while she was putting the seeds in the cups , '' her son said.
plant | planting			putting	growth		You have to hope you 're putting in place some seeds that may come to growth , '' he says stoically.
plant | planting	seeds		putting			This putting of the enmity between the two seeds was the commencement of the plan of mercy , the first act in the programme of grace.
plant | planting			putting			If you want eastern goldfinches to visit you , try putting out some sunflower seeds - that 's their favorite treat.
plant | planting			putting	skillet over		Make the dressing by putting the sesame seeds into a small skillet set over a medium-high heat.
plant | planting			putting	the ground		Other men his age take up activities of their boyhood years , putting fruit seeds into the ground or collecting stamps.
plant | planting			putting	the pan jar		Strain , putting the fat back into the pan and the seeds into the blender jar , and blend as smooth as possible.
plant | planting			putting			Dampen the mix before putting your seeds in.
plant | planting			putting			It turned out that the great lot of work which went into putting on that public meeting sowed abundant seeds.
plant | planting			putting			For example , we may think of agriculture as the act of putting seeds in the ground , waiting for rain , and harvesting the crop.
plant | planting			putting			Here was this person , far away from home doing nothing but putting apple seeds into the ground to make more apple trees.
plant | planting		starting	putting			There 's a hopefulness to farming : every year putting new seeds in the ground and starting again.
plant | planting			putting			You can get the Evening Grosbeak to come to your backyard by putting out corn and sunflower seeds.
plant | planting			putting			They use only the digging stick for putting in the seeds.
plant | planting			putting	seeds		Here she 's putting in some of my saved marigold seeds from last year.
plant | planting			putting			And it 's only by putting out those seeds that you can look forward to some fruit in two to three months.
plant | planting			putting			Jessie Mae spent a lot of my money putting those flower seeds and rose bushes around everywhere.
plant | planting			putting			That makes this the perfect time for putting your seeds in the ground.
plant | planting			putting			She was instrumental in putting together last year &#146; s Seeds concert.
plant | planting			putting	blender		Be sure to remove all the seeds before putting the pulp into a blender because the seeds are toxic.
plant | planting	plant		putting	seeds		Those few still using old-style plant beds finished putting their seeds in the ground several weeks ago.
plant | planting	stores	seed	putting			Collecting and putting seeds in seed stores is a second best solution , but even that is underfunded and un-coordinated.
plant | planting			putting			If we want to raise a garden we know that it must start by putting seeds in the ground.
plant | planting			putting	the		Yah-Rah means to cast , throw or shoot as putting seeds into the ground.
plant | planting	box		putting			We placed a squirrel feeder on the tree below the nest box , and have been putting out seeds , nuts , and fruit in the late afternoon.
plant | planting			putting	seeds		Sometimes he would cover considerable tracts , putting in as many as 16 bushels of seeds to the acre.
plant | planting			putting			In this activity , show students understanding of a number 's value by putting the corresponding number of seeds on each apple.
plant | planting			putting			Students show their understanding of the number 's value by putting the corresponding number of seeds on each apple.
plant | planting			Put			For the benefit of both bears and people , the advice is simple : Put your bird feeders away and pick up the spilled seeds.
plant | planting			putting	seeds rain		But so is putting seeds in the ground and praying for rain.
plant | planting			putting			We have been putting out some sunflower seeds.
plant | planting			putting			`` That dependency can be colloquially described as farmers putting all their seeds in a very few distant corporate baskets.
plant | planting			putting			There is something amazing about putting little seeds in the ground and seeing a big harvest.
plant | planting			Putting	seeds		Planting Angophora costata seed Putting 3 seeds in each pot.
plant | planting	place		putting	classes of		But those who abolish classes for the purpose of putting new classes in their place sow the seeds of new revolutions.
plant | planting	seeds		putting			Try putting salt on the wheat seeds after they have sprouted.
plant | planting			putting			In the spring the evenings were spent in the garden putting in seeds ; otherwise we did as we pleased.
plant | planting			putting			The empty seed can be separated from the good seed by putting the seeds in ethyl alcohol.
plant | planting			putting			Do n't even think of putting tomato seeds in the open ground yet.
plant | planting			putting	the ground		You 're `` putting seeds into the ground.
plant | planting		large	putting	seeds		Everyone smiles , putting large hopes in little seeds.
plant | planting			putting			All for the crime of putting a handful of marijuana seeds in the ground.
plant | planting			putting	the soil		One of the most sacred rights of a farmer is to know exactly what seeds he is putting into the soil.
plant | planting			putting			Farming is no longer simply putting seeds in the ground , watching it grow , harvesting and taking it to market.
plant | planting			putting	grow		`` There 's a certain magic of putting seeds in the ground and watching them grow , '' Terry says.
plant | planting			Putting	seeds		Putting the fertilizer bands too close to seeds will burn seedling roots.
plant | planting			putting	seeds		Make the soil firm by putting the board on the seeds and standing on it.
plant | planting			putting			Some of us will be busy working our fields , planting , blending with nature , putting in our seeds , watching them appear.
plant | planting	plants		putting			Gradually , they learned that putting the seeds in the soil made the plants grow bigger and more fruitful.
plant | planting			putting	pots seeds		From January we began making compost , putting soil into pots and sowing seeds.
plant | planting			putting	seeds		Sometimes he would cover considerable tracts with his plantings , putting in as many as sixteen bushels of seeds to the acre.
plant | planting	seeds		putting			18 - Also at this time , you might also want to start putting a bin of seeds in his cage.
plant | planting			putting			He recalled his wife separating pomegranate seeds from the pomegranate skin and putting the seeds onto a plate.
plant | planting	plants		putting			Activists dug up most of the grassy area of the square opposite the Commons , putting down plants and seeds and digging ponds.
plant | planting	seeds		putting			At this time , you might also want to start putting a bin of seeds in his cage.
plant | planting			putting			Plant seed about 3 / 4 inch deep , putting about 2 seeds per inch in rows 4 to 6 inches apart.
plant | planting	water food plant		putting			Irrigation is any man-made way of putting water onto land to grow food and other plant products.
plant | planting			putting			`` We 're putting Kodak digital technology to work to grow the picture business , '' she concluded.
plant | planting			putting			The Lord indeed hath adorned them , putting his beauty upon them , and causing them to grow up in his strength , and in his wisdom.
plant | planting			putting	room		Try putting one in the grow room.
plant | planting			putting			We do n't , he said , putting a finger in my face , need to grow anymore.
plant | planting			putting			We hope you will bookmark us and enjoy the humor and fun we have putting all this together as we grow.
plant | planting	his		putting	it grow		But instead of closing his travel agency , Matt started putting all his efforts to making it grow.
plant | planting	plants		putting			She can use this fertilizer by putting it on her plants to help them grow.
plant | planting	environments that		putting			We should be putting frail elders in environments that help them grow.
plant | planting	food		Putting			`` Putting your hands in the soil and helping things grow , whether flowers , food , or whatever , can offer so much for people.
plant | planting			putting	financial		Today , the need to grow is putting a financial pinch on the company.
plant | planting			putting			While putting out the fire a marijuana grow operation was located in the basement of the home.
plant | planting	MPs		putting			Whilst voting Tory does n't seem as trendy as it used to , we are a vibrant and jazzy group , putting fun where MPs grow bald patches.
plant | planting			putting			Typically , as software changes and companies grow , you will be putting more demands on your server and it has to be able to adapt.
plant | planting			putting			Consider the following when developing a plan and let us help you by putting the pieces together to help you grow.
plant | planting	plants	putting water	putting			Like changing plants putting in new plants that grow and putting in a water system.
plant | planting			Putting			Putting away doughnuts , grow to full heft ( 2 , 2 ; abbr.
plant | planting			putting			He was putting away his violin , but she saw his neck grow red.
plant | planting			putting			The procedures on how to grow mold were putting bread in plastic bags and letting them sit for 5 days.
plant | planting			putting			That 's the power of savings -- putting aside money now and letting it grow.
plant | planting			putting			This wedge between them is growing , but the vocal one thinks they are putting the other straight so they can grow.
plant | planting			putting			The key , of course , is putting together the components to grow such companies.
plant | planting			putting			As we grow , we 'll be putting in other managers.
plant | planting			putting			&#147; The hard work of putting things together is the rewarding part , putting it together and watching it grow.
plant | planting	fish		putting			The constant canal flows contribute to these fish having much firmer flesh and putting on muscle instead of fat as they grow.
plant | planting			Putting			Best thing about the job : Putting together a summer program , marketing it and seeing it grow over the year.
plant | planting			putting			When you ask a 2-year-old to grow , milk , and reproduce , you are putting a lot of stress on her.
plant | planting			putting	ranker		One of the memorable compost quotes is Shakespeare 's line about `` putting compost on weeds to make them grow ranker.
plant | planting			putting			`` When kids grow up too fast , they 're just putting on a veneer and they think they 're grown up.
plant | planting			putting	positions them		But God has a way of putting us into positions and letting us grow into them.
plant | planting			putting			They are looking at the possibility of putting chips or some kind of treatment that will get natural grass to grow.
plant | planting			putting			Stop putting the blame anywhere but the place it belongs and , most importantly , grow up.
plant | planting			putting			Site Map As our site continues to grow , we will be putting together a site map to facilitate navigation for our visitors.
plant | planting			putting			`` The hard work of putting things together is the rewarding part , putting it together and watching it grow.
plant | planting	50 savings		putting			If you 're a novice at investing , you can get an easy start by simply putting $ 50 in a savings account and letting it grow.
plant | planting	plants		putting	single cells that will then		One of the first steps involves putting genes into single cells that will then grow into whole plants.
plant | planting	animals pastures		putting			But feeding them dead animals is cheaper and quicker than putting them out in pastures to grow naturally.
hibernate | hibernation		winter	hibernate			For this reason reptiles are not found in the coldest regions of the world , and they hibernate in cool winter areas.
hibernate | hibernation	animals		hibernate			Many other animals hibernate , from various birds and reptiles to mammals such as woodchucks and rodents.
hibernate | hibernation		winter	hibernate			The bats leave in the fall , flying to a cave or abandoned mine tunnel to hibernate for the winter.
hibernate | hibernation	animals	winter	hibernate			Known hibernacula ( places where animals hibernate ) are monitored every other winter.
hibernate | hibernation		winter	hibernate			In the winter , when no insects are available , bats hibernate.
hibernate | hibernation		winter	hibernate			Pikas do not hibernate over winter.
hibernate | hibernation		winter	hibernate			This species does not hibernate and is active all winter.
hibernate | hibernation	animals	winter	hibernate			hibernacula &#151; places where bats or other animals hibernate , or sleep , during the winter to conserve energy.
hibernate | hibernation		winter	hibernate			They then return to the hibernacula in October and hibernate through the winter.
hibernate | hibernation	animals	winter	hibernate			During the winter , many of these animals hibernate or migrate to escape the long , cold winter months.
hibernate | hibernation		winter	hibernate			They hibernate in the mud during the winter.
hibernate | hibernation		winter	hibernate			During the winter months the gators hibernate in `` wallers '' they hollow out along the banks.
hibernate | hibernation		winter	hibernate	the bottom mud		In winter , eels hibernate , burrowing into the bottom mud.
hibernate | hibernation		winter	hibernate			They store food and hibernate in the winter.
hibernate | hibernation	animals		hibernate			These solitary animals hibernate from October to March.
hibernate | hibernation		winter	hibernate			They may hibernate in winter.
hibernate | hibernation		winter	hibernate			Although they sleep through the winter , they do not truly hibernate because their heart rate and temperature do not decrease.
hibernate | hibernation		winter	hibernate			There is an ongoing debate whether black bears truly hibernate in the winter.
hibernate | hibernation		winter	hibernate			Bears hibernate for the winter.
hibernate | hibernation		winter	hibernate			They love cold water and hibernate in the winter.
hibernate | hibernation		winter	hibernate			- The pupae hibernate in the ground and the adults appear as early as the end of winter but mainely in spring.
hibernate | hibernation		winter	hibernate			Other species of lady beetles are also known to aggregate in sheltered spots where they hibernate for the winter.
hibernate | hibernation	animals	Winter	hibernate			The Perils of a Long Winter 's Sleep by Madeline Bodin No wonder animals hibernate.
hibernate | hibernation		winter	hibernate			Others do both : migrate south , then hibernate for part of the winter there.
hibernate | hibernation		winter	hibernate			But Vermont 's most frequently seen bats -- the two species that end up roosting in eaves and attics -- both do hibernate in winter.
hibernate | hibernation		winter	hibernate			Themigrate south , then hibernate for part of the winter there.
hibernate | hibernation		winter	hibernate			They do not truly hibernate , but they do `` hole up '' in dens and become inactive during severe winter weather.
hibernate | hibernation		winter	hibernate			They run a small T-shirt shop up there for about 6 months of the year during the summer and then hibernate through the winter.
hibernate | hibernation		winter	hibernate			`` In temperate zones mosquitoes hibernate in winter and transmit actively in warm weather.
hibernate | hibernation		winter	hibernate			Readers learn that frogs are amphibians and carnivorous and that they hibernate over the winter.
hibernate | hibernation		winter	hibernate			Many species hibernate through the winter months.
hibernate | hibernation		winter	hibernate			They congregate on walls , walks , furniture , drapes , and other objects , and will hibernate in the structure for winter.
hibernate | hibernation	animals		hibernate			There are two basic places that animals hibernate in.
hibernate | hibernation	animals		hibernate			Various animals that hibernate go to tell the other animals.
hibernate | hibernation		winter	hibernate			Many squirrel species hibernate during the winter months , when it becomes too cold for them to venture out for food.
hibernate | hibernation		winter	hibernate			Seasonal Activity : Southern Flying Squirrels do not hibernate , or migrate , during the cold months of winter.
hibernate | hibernation		winter	hibernate			In the fall , they burrow deeper into the soil to hibernate during the winter.
hibernate | hibernation		winter	hibernate			In harsh climates , frogs bury themselves in sand and mud and hibernate ( sleep very deeply ) through the cold winter.
hibernate | hibernation	Animals		hibernate			Animals hibernate and we need to respond to the need to slow down during the cold months.
hibernate | hibernation	animals		hibernate			We 're part of the animal kingdom and we need to remember that animals hibernate and seeds lie dormant during this time of year.
hibernate | hibernation		winter	hibernate			Interesting Facts : During the winter months , bog turtles hibernate underwater in deep areas of bogs in about 6 to 18 inches of mud.
hibernate | hibernation		winter	hibernate			In cold climates , gopher snakes hibernate during the autumn and winter months.
hibernate | hibernation		winter	hibernate			Skunks do not hibernate , although they may remain dormant underground all winter.
hibernate | hibernation		winter	hibernate			Tourism is still important , but it 's not creating a boom economy : Ashton seems to sleep in summer and hibernate in winter.
hibernate | hibernation		winter	hibernate			The perfect time to dive into what 's happening here in this little burg of 500,000 , before we all go hibernate for winter.
hibernate | hibernation		winter	hibernate			They live most of their lives underground and hibernate each winter for about 5 months.
hibernate | hibernation		winter	hibernate			Most chelonians live in warm parts of the world and some hibernate in winter if brought to a cold country.
hibernate | hibernation	animals	winter	hibernate			Not all animals hibernate in the winter.
hibernate | hibernation		winter	hibernate			In outdoor ponds , hardy turtles will hibernate during the cold winter months.
hibernate | hibernation		winter	hibernate			The turtles found farther north hibernate in the winter.
hibernate | hibernation		winter	hibernate			The bears will hibernate through the nasty winter.
hibernate | hibernation		winter	hibernate			Life History - Adult beetles hibernate during the winter in the soil of well-drained sod land.
hibernate | hibernation		winter	hibernate			They do not hibernate , so you may see them in winter.
hibernate | hibernation		winter	hibernate			In cooler areas , they hibernate during winter beneath fallen timber or other debris as shelter against frost and cold.
hibernate | hibernation		winter	hibernate			Raccoons do not truly hibernate in winter , but `` hole up '' for days , weeks , or even months , depending on the weather.
hibernate | hibernation		winter	hibernate			They hibernate in the winter and may also be inactive periodically during hot summer weather.
hibernate | hibernation		winter	hibernate			Solution # 2 -- Covering your plant 's soil : Some plants hibernate during the winter and almost look dead.
hibernate | hibernation		winter	hibernate			Bears , for instance , hibernate during the winter , and thus possessed the magick of dreams.
hibernate | hibernation		winter	hibernate			In cold areas of the State , snakes hibernate during winter.
hibernate | hibernation		winter	hibernate			Bats hibernate in winter.
hibernate | hibernation		winter	hibernate			They also hibernate all winter , and can be taught to water-ski.
hibernate | hibernation		winter	hibernate			They keep the slugs at bay in the summer and hibernate in the winter.
hibernate | hibernation		winter	hibernate			Murtle has been with us forthe slugs at bay in the summer and hibernate in the winter.
hibernate | hibernation		winter	hibernate	survive		Only the new queens survive to hibernate in a tree cavity through the winter and emerge in spring to start the cycle all over again.
hibernate | hibernation		winter	hibernate			Adults may hibernate or remain active throughout the winter.
hibernate | hibernation		winter	hibernate			Unlike most mammals that winter in the high Arctic , lemmings do n't hibernate.
hibernate | hibernation		winter	hibernate			Alaskans do n't hibernate in winter.
hibernate | hibernation		winter	hibernate			Summer hikers and backpackers are finally learning that they do n't have to hibernate on the couch come winter.
hibernate | hibernation		winter	hibernate			Many species of bats migrate in the fall and hibernate throughout the winter months in caves , mines , or buildings.
hibernate | hibernation		winter	hibernate			Mosquitoes , like bears , hibernate through the winter cold.
hibernate | hibernation	Animals		hibernate			Animals hibernate in their warm burrows , waiting patiently for the spring thaw.
hibernate | hibernation		winter	hibernate			You will learn that some turtles are aquatic while others hibernate during the winter months that live in northern climates.
hibernate | hibernation		winter	hibernate			The scientists fear that ticks and mosquitoes , which hibernate for winter , could return in the spring and spread the virus.
hibernate | hibernation		winter	hibernate			This does n't allow the existance of a great number of reptiles in cold climate areas , where they have to hibernate during winter.
hibernate | hibernation		winter	hibernate			Desert spiny lizards hibernate in winter , except for brief activity on warmest days.
hibernate | hibernation		winter	hibernate			It has stored enough energy in it 's root to hibernate all winter.
hibernate | hibernation		winter	hibernate			They hibernate during the winter months and are active from March through October.
hibernate | hibernation		winter	hibernate			In temperate climates , well-fed snakes can hibernate all winter without feeding.
hibernate | hibernation		winter	hibernate			Over most of its range , fertilized female adults hibernate in winter in protected areas.
hibernate | hibernation		winter	hibernate			Does not hibernate ; often appears abroad on warm nights in middle of winter in North ; active all winter in South.
hibernate | hibernation		winter	hibernate			Woodchucks hibernate during the winter.
hibernate | hibernation		winter	hibernate			They eat plants and some insects , and live in colonies , make burrows ( one to each family ) , and hibernate in winter.
hibernate | hibernation		winter	hibernate			In winter , up to one hundred individuals hibernate together.
hibernate | hibernation		winter	hibernate			Marmots hibernate both summer and winter.
hibernate | hibernation		winter	hibernate			Both juvenile and adult blue crabs forage on the bottom and hibernate there through the winter.
hibernate | hibernation		winter	hibernate			They hibernate in dens in the winter and eat fish , small mammals , birds and turtles.
hibernate | hibernation		winter	hibernate			Bears hibernate in the winter.
hibernate | hibernation		winter	hibernate			In the winter hamsters hibernate.
hibernate | hibernation	animals		hibernate			Many snakes hibernate in burrows dug by other animals.
hibernate | hibernation	animals		hibernate			Inside : Migration patterns change and animals hibernate out of season.
hibernate | hibernation	animals	winter	Hibernating|hibernate	a very deep sleep		Hibernating Animal Printouts Some animals hibernate over the winter , going into a very deep sleep.
hibernate | hibernation	animals		Hibernating			Hibernating animals usually retreat to a den , a burrow , or a hollow log for protection and shelter.
hibernate | hibernation	animals	winter	hibernate			( hibernate ) 400 - When animals move to warmer areas for the winter , they do this.
hibernate | hibernation	animals		hibernate			Some animals hibernate ; those that do n't have a more difficult time finding food in a forest covered with snow or in a frozen pond.
hibernate | hibernation	animals		hibernate			When animals do n't hibernate , they become anxious , overly aggressive and sluggish.
hibernate | hibernation	animals		hibernate			Many animals hibernate , further reducing the space and food required to support the animals.
hibernate | hibernation	animals	winter	hibernate			Other animals find a warm place to hole up and hibernate for the winter.
hibernate | hibernation	animals		hibernate			Trees keep growing , mosses are rich green , and most animals never completely hibernate.
hibernate | hibernation	animals	winter	hibernate			Though most small animals hibernate through the winter Porcupines and Ermines ( white weasels ) can often be seen.
