migrate | migration	animals		migrate			Tanzania offers excellent game viewing throughout the year as not all animals migrate and are year-round residents.
migrate | migration	animals	the game animals	migrate			Predatory animals migrate with the game animals.
migrate | migration	Animals		migrate			Animals will not usually migrate from one area to another since the plant life varies.
migrate | migration	animals		migrate			^ Behavior Most populations of blue whales are migratory , though some animals do not migrate.
migrate | migration	animals		migrate			As with salmon , geese , and other animals , many sharks also migrate.
migrate | migration	animals		migrate			Reproduction : Sharks , like many other animals , migrate for purposes of mating and giving birth.
migrate | migration	animals		migrate			In colder climates , many animals must migrate to lower elevations for food during the winter.
migrate | migration	animals		migrate			Wildlife can migrate unobstructed ; animals will never be killed as they are when they cross roads.
migrate | migration	animals		migrate			When winter arrives , some animals will migrate to warmer regions or climates.
migrate | migration	animals		migrating			Of course yards can also be reinfested by migrating animals carryingice when they did.
migrate | migration	animals		migrate			Furthermore they find that birds and animals migrate to the north to feed and breed , instead of to the south.
migrate | migration	animals		migrate			Migration Find out which animals in your area migrate in the spring and fall.
migrate | migration	animals		migrate			Over the long term , the animals migrate from burn to burn.
migrate | migration	Animals		migrate			Animals can migrate long distances , especially when impelled to do so by imminent weather changes.
migrate | migration	Animals		Migrate			How and Why Animals Migrate.
migrate | migration	animals		migrate			Many animals migrate , but the most spectacular example of such natural phenomenon is the migration of birds.
migrate | migration	animals		migrate			They live in herding camps and migrate seasonally with their animals.
migrate | migration	animals		migrate			The Mandara are among other tribes of Sudanic herdsmen who migrate seasonally with their animals , searching for fresh grazing lands.
migrate | migration	animals		migrate			Find out when the native plants bloom , when the birds migrate , the animals mate , the young are born.
migrate | migration	animals	months	migrate			During the colder months , animals migrate to warmer areas or lower altitudes.
migrate | migration	animals		migrate			Other animals migrate to warmer climates.
migrate | migration	animals		migrate			We 've seen animals migrate as their plant and/or animal prey becomes available along the trail.
migrate | migration		cold	migrate			Birds migrate to southern hemisphere to escape the cold.
migrate | migration	animals		migrate	habitat		The animals move or migrate to the most favorable sites as the habitat becomes less suitable for them.
migrate | migration	animals		migrate	the groundwater		Another issue is whether arsenic and metals migrate into the groundwater or into plants that animals may consume.
migrate | migration	animals		migrate			Some animals migrate in search of better conditions , such as weather , food , or for breeding purposes.
migrate | migration	Animals		migrate			Animals migrate between their wintering and breeding habitats.
migrate | migration	animals		migrate			Some animals migrate , moving to warmer climates where food is available.
migrate | migration	animals		migrate			Learn how and why animals migrate and meet some of the migrants that use Long Island during their journey along the Atlantic Flyway.
migrate | migration	animals		migrate			Most animals migrate to find food to get away from predators every two years.
migrate | migration	animals		migrate	hibernation		Some taiga animals migrate south , others go into hibernation , while others simply cope with the environment.
migrate | migration	animals		migrate			When animals migrate , it is usually to an energy source or for energy reasons.
migrate | migration	animals		migrated			As the animals migrated , the Native people also migrated to follow the resource.
migrate | migration	animals	cold	migrate			However , when the cold of winter comes , many birds migrate southward and some small animals hibernate.
migrate | migration	animals		migrate			He no longer needed to migrate following the herding patterns of animals to hunt.
migrate | migration	animals	cold	migrate			Some of the animals migrate for the long , cold winters and others hibernate.
migrate | migration	animals	cold	migrate			Some of the birds and animals alsoanimals migrate for the long , cold winters and others hibernate.
migrate | migration	animals		migrate			Some of the birds and animals also migrate or hibernate for the winters in this area.
migrate | migration	animals		migrate			These animals migrate , but usually return to preferred winter and summer grounds.
migrate | migration	animals		migrate			Knowing reasons animals or people might migrate.
migrate | migration	animals		migrate			Some animals , like the monarch butterfly , migrate , or fly south , to live in warmer temperatures.
migrate | migration	animals		migrate			Other animals migrate , or travel to a place with warmer weather and more food.
migrate | migration	animals		migrate	habitat		`` As global warming accelerates , plants and animals will come under increasing pressure to migrate to find suitable habitat.
migrate | migration	animals		migrate			Large numbers of animals traditionally migrate between Sudan and South Africa.
migrate | migration	animals		migrate	the Labrador West area		These animals migrate into the Labrador West area during the winter to feed.
migrate | migration	animals		migrate			Discover why some animals migrate and how they find their way.
migrate | migration	animals		migrate			During this time of the year thousands of animals migrate from dry Masai steppes to the Tarangire River looking for water.
migrate | migration	animals		migrate			One for animals that they know migrate , one for animals that they think migrate , and one for animals that they think do n't migrate.
migrate | migration	animals		migrate			Have students research their area and find out what animals migrate.
migrate | migration	animals		migrate			If the plant is more common intertidally , then that is where the animals will `` migrate '' to.
migrate | migration	animals		migrate			When immature cells are transplanted under precisely the right conditions , they migrate across the animals ' tiny damaged brains.
migrate | migration	animals		migrate			Some animals migrate and therefore come and go seasonally.
migrate | migration	animals		migrate			Contaminants can be transported from a source as animals migrate or food crops are harvested.
migrate | migration	animals		migrate			Plants migrate , their seeds spread by wind , water and animals ( including people.
migrate | migration			migrated	habitat		Would they have naturally migrated here , spread by wind orof valuable habitat in the process.
migrate | migration	animals		migrate			Fish , crabs , and other mobile animals migrate to and from the coastal pools according to the tides and prevailing conditions.
migrate | migration	animals		migrate	habitat		Tropical diseases will spread to new territories , carried by insects and animals that migrate in search of more suitable habitat.
migrate | migration	animals		migrate			Grazing animals can migrate while pregnant ; they eat as they go along and migration does n't consume extra energy to speak of.
migrate | migration	animals	their flocks between Summer and Winter pastures	migrate			Those Navajos who have animals , migrate with their flocks between Summer and Winter pastures.
migrate | migration	animals		migrate			The animals do n't migrate , so an estimated 30,000 animals , including the rare black rhino , live within 100 square miles.
migrate | migration	animals		migrate			Many of the big animals migrate to lower elevations , windblown slopes and nearer to geothermal areas to winter.
migrate | migration		cold	migrate			Many varieties of birds and waterfowl migrate south to avoid the cold.
migrate | migration	Animals		migrate			Animals can migrate from north to south , east to west , or even from the top of a tree to below the frost line.
migrate | migration	animals		migrate			Red Foxes Many animals migrate or hibernate when their favorite foods are unavailable.
migrate | migration	animals		migrate			However , the majority of animals migrate hundreds of kilometers to successive areas of flowering trees , primarily eucalypt species.
migrate | migration	animals		migrate			All of these animals migrate , too.
migrate | migration	animals		migrates			Who migrates : Many types of animals , but birds are the best known.
migrate | migration	animals		migrate			The flatland animals further north continually migrate to the Killarney area.
migrate | migration	animals		migrate			During the winter these animals migrate to deep water.
migrate | migration	Animals		migrate	shallow waters		Animals may migrate into shallow waters to spawn but no aggregation of animals during spawning has been noted.
migrate | migration	animals		migrate			In this book , readers learn that some animals , such as geese , butterflies , and whales , migrate south.
migrate | migration	animals		migrate			These species require the coordinated and concerted action of countries through which the animals migrate.
migrate | migration	animals		migrate			Cougars may migrate with their prey animals , as when deer seek lower altitudes during the winter.
migrate | migration	animals		migrate			Some animals , particularly birds , migrate to and from the desert.
migrate | migration	animals		migrate			`` Some of the smaller animals also migrate , like mole salamanders who need travel corridors and vernal pools.
migrate | migration	animals		migrate			Unlike in many other species of animals , whales do n't migrate for food.
migrate | migration	animals		migrate	habitat		> Migration is moving from one habitat to another , so animals do n't usually migrate every season.
migrate | migration	animals		migrate			In the winter , most of these animals migrate to the south.
migrate | migration	animals		migrate			The animals also migrate in the appropriate season.
migrate | migration	animals	months	migrate	farmland		Some animals migrate into farmland for a few months before returning to the park.
migrate | migration	animals		migrate			Discover why some animals migrate , and find out where they travel.
migrate | migration	animals	less restriction than perhaps anywhere	migrate			At Singita , animals migrate with less restriction than perhaps anywhere outside Botswana 's Okavango Delta.
migrate | migration	animals		migrate			These animals migrate long distances every year.
migrate | migration	animals		migrate	habitat		As global warming accelerates , plants and animals will come under increasing pressure to migrate to find suitable habitat.
migrate | migration	animals		migrate			Many animals migrate in the fall or winter.
migrate | migration	animals		migrate			Some animals , such as many birds and whales , migrate over long distances , and perform remarkable feats of navigation in doing so.
migrate | migration	animals		migrate	habitat		The emergency of land permitted sea plants to migrate to this new habitat , followed by sea animals.
migrate | migration	Animals		migrate			Animals migrate , but so do humans.
adaptation		environment	Adapt|adapted			Adapt or perish Living things that are better adapted to their environment have an advantage over their competitors.
adaptation			adapted	survival		Humans evolved with physical characteristics that were adapted to survival.
adaptation	Plants		adapted			Plants native to Fort Collins are adapted to our rainfall , temperatures , and soil types.
adaptation		environment	adapted			Each kind of animal and plant is uniquely and finely adapted to its environment.
adaptation	plants		adapted			Results suggest that symbiotic alfalfa plants are better adapted than non-symbiotic ones to cope with water deficit.
adaptation	plants		adapted			We have adapted this hydroponic growing method for our plants.
adaptation	plants		adapted			Life history strategies in plants and animals often are adapted to life in aquatic environments.
adaptation	Plants		Adapted			Adapted from Raven , Biology of Plants.
adaptation	plants		adapted			Few plants are ecologically adapted to the extreme variations in water level , although annual grasses and sedges flourish.
adaptation	plants		adapted			These plants have adapted to a natural tidal cycle which no longer exists.
adaptation	plants		adapted			- Nursery The Nursery at Civano specializes in native and desert adapted plants , and offers workshops on desert gardening.
adaptation	plants		adapted			It is not surprising that they are well adapted to root vegetables and other wild , indigenous plants.
adaptation	plants		adapted			Some grasses or grass-like plants are adapted to wet soils , but most require a well-drained soil.
adaptation	plants		adapted			Yet many species of plants and animals have adapted to these conditions and some species can live nowhere else.
adaptation	plants		adapted			Only plants and animals specially adapted to dry , hot sandy conditions can survive.
adaptation	plants		adapted			The plants are adapted to fire , meaning that the plants actually need fire as a part of their lives.
adaptation	Plants		adapted			Species Extinction - Plants and animals are uniquely adapted to live within particular ecosystems.
adaptation	plants		adapted			Native plants are adapted to growing in the prairies.
adaptation	plants		adapted			Native prairie plants are adapted to growing in the prairies and provide essential habitat for prairie wildlife.
adaptation	plants		adapted			Most mountain plants are adapted to growing in small cracks in the rock with hardly any goodness in what little soil there is.
adaptation	plants		adapted			Select plants adapted to the site that also provide wildlife foods or cover.
adaptation	plants		adapted			This dune habitat is home to many unique and specially adapted plants and animals.
adaptation	plants		adapted			Desert Biome that has plants and animals adapted to survive severe drought conditions.
adaptation	plants		adapted			The peg-like teeth are adapted for eating soft food , perhaps aquatic plants.
adaptation	plants		adapted			&#9; `` They have adapted themselves for eating desert plants , which is a bit toxic to a normal , standard horse , '' continues Hall.
adaptation	plants		adapted			The plants and animals here are adapted for the special conditions of life in each of these different environments.
adaptation	plants		adapted			Now Cummins has adapted this technology for diesel power plants.
adaptation	plants		adapted			In coastal wetlands , the plants have adapted to the harsh living conditions of salt and wind.
adaptation	plants	environment	adapted			Freshwater marsh plants have adapted to their aquatic environment in several ways.
adaptation	plants		adapted			Native plants are adapted to this region and are more likely to be pest and disease resistant.
adaptation	plants		adapted			In general , the plants are adapted to cope with the hot , dry conditions and saline environments.
adaptation		environment	adapted			The Desert pupfish is adapted to live in the extreme climate of a harsh desert environment.
adaptation	plants		adapted			Many plants , long-day and day-neutral species , are better adapted to these locations.
adaptation	Plants		adapted			Plants adapted to local conditions require less water and less attention.
adaptation	plants		adapted			In contrast , many plants that are native to Iowa are adapted to alkaline soils.
adaptation	plants	environment	adapted			Using native plants that have adapted to our environment should be the first choice in any landscaping plan.
adaptation	plants		adapted			Species of plants have adapted to specific conditions over millions of years.
adaptation		environment	adapted			The acidic , nutrient poor , and waterlogged bog habitat deters the growth of plant species not adapted to such an environment.
adaptation		environment	adapted			Since they have evolved for millennia in a moist , acidic environment , their roots have adapted.
adaptation	plants		adapt			List two ways in which plants adapt to crown fires.
adaptation	plants		adapt			List two ways in which plants adapt to surface fires.
adaptation	Plants		adapted			Plants adapted to life in water or in waterlogged substrates are called hydrophytes.
adaptation	plants		adapted			These plants have adapted to the droughts and valley heat of summer.
adaptation	plants		adapted			Many plants have adapted to the fires.
adaptation	plants		adapted			Native plants and wildlife have adapted to frequent fires.
adaptation	plants		adapted			They have large deep-rooted teeth which are well adapted to grazing coarse plants , and they do not tear , but bite off cleanly.
adaptation	plants		adapted			These plants are adapted to the climate in your area.
adaptation	plants		adapted			In pre-settlement times , small fires could occur all through the year , and native plants are well adapted to fire.
adaptation	plants		adapted			Many plants adapted to dry summers do not need much water a few years after planting.
adaptation	plants		adapted			These plants are naturally adapted to the climate of your area and are a good long-term investment.
adaptation	plants		adapted			Some plants are well adapted to this kind of spatial and temporal variation.
adaptation		environment	adapted			Compare and contrast how ferns and mosses have adapted to a land environment.
adaptation	Plants		adapted			(- Plants are more strictly adapted to climate than are animals.
adaptation	plants		adapted			Over thousands of years , more than 1700 different native plants have adapted to specific North Cascade habitats.
adaptation	plants		adapted			But our native plants are well adapted for dryness.
adaptation	plants		adapted			Coyote Creek - Louisiana grower of herbs and native plants adapted to the Southern United States.
adaptation	plants		adapted			Stunted plants have adapted perfectly to their habitats.
adaptation	plants		adapted			Such plants and seeds are best adapted to the local climate , soil , predators , pollinators and disease.
adaptation	plants	environment	adapted			Aquatic plants however are well adapted to this environment and carry oxygen through their root channels.
adaptation	plants		adapted	survival		Click on the image to enlarge As you can plainly see , plants have adapted in many ways to ensure their survival on this planet.
adaptation	Plants		adapted			Plants in the cabbage family are adapted to cool weather and grow best when temperatures are between 60 and 80 degrees.
adaptation	plants		adapted			Cold adapted plants such as some species of conifers are known to grow in the tropics.
adaptation	plants		adapted			Vigorous plants are well adapted to extremes in temperature.
adaptation	plants	environment	adapted			Missouri 's prairies are home to an array of plants and animals superbly adapted to the stresses of the prairie environment.
adaptation	plants		adapted			These plants have adapted to survive under conditions where most other plants could not.
adaptation	plants		adapted			These blazes often burn hotter -- and deeper -- killing off many native plants adapted to a cooler-burning fire.
adaptation	plants		adapted			Landscape designs at the festival use adapted plants , which offer a variety of advantages.
adaptation	plants		adapted			These plants are better adapted to alkaline soils , thrive on less water and perform best in partial shade.
adaptation	plants		adapted			C4 plant few members of Millet tribe have C4 ability very competitive with row crop plants adapted to high temps.
adaptation	plants	environment	adapted			It hosts a fascinating number of plants and animals adapted to live in the harsh volcanic and high desert environment.
adaptation	Plants		adapted			Plants from southern origin are adapted to shorter day lengths and a long frost-free period.
adaptation	plants		adapted			Use native plants adapted to the area.
adaptation	plants		adapted			Wetland plants are specially adapted to the flooded or saturated conditions typically found in wetlands.
adaptation	plants		adapted			Some plants are even adapted to the soil and water of one type of wetland.
adaptation	plants		adapted			Uncontrolled selection of fire adapted plants.
adaptation	plants		adapted			Since the plants are better adapted to local soil and water conditions , they require less water and maintenance.
adaptation	plants		adapted			There are many species , often adapted to particular plants ; some are agricultural pests.
adaptation	plants		adapted			Some shade-tolerant plants are adapted to low moisture situations , while others require moist shade.
adaptation	Plants	environment	adapted			Plants and animals have adapted in unique ways to deal with this environment.
adaptation	plants		adapted			Many plants and animals are well adapted to particular kinds of disturbance.
adaptation	Plants		adapted			Plants are adapted to acid soil and the lack of nutrients.
adaptation	plants		adapted			In natural habitats , plants are adapted to a very specific set of conditions.
adaptation	plants		adapted			Certain plants are adapted to this acid water.
adaptation	plants		adapted			Water quickly runs off or drains through the porous medium , so plants are adapted to hot and dry conditions.
adaptation	plants		adapted			Tall plants in the pine forest are adapted to acid soil and the lack of nutrients.
adaptation	plants	developing leaves that float	adapted			Some plants in wet areas , such as water lilies , have adapted to the standing water by developing leaves that float.
adaptation	plants	environment	adapted			Within the extremely harsh environment of the dune field , even plants and animals adapted to desert conditions struggle to survive.
adaptation	plants		adapted			They have adapted very well by placing many potted plants under the front face.
adaptation	plants		adapted			Native plants are more adapted to summer dryness often associated with New England summers thus requiring less watering.
adaptation	plants	environment	adapted			Identify the type of environment or climate to which these plants have adapted.
adaptation	plants		adapted			And because native plants are well adapted to your climate , soil conditions , and so on , they should also be easier to care for.
adaptation	plants		adapted			Identifies creatures and plants adapted to specific environments.
adaptation	plants		adapted			All plants havepoorly adapted to stress imposed by temperature.
adaptation	plants		adapted			Many animals and plants have adapted to life in a sea of drifting sand.
adaptation			adapted	survival		They are adapted to it and many of them depend on fire for regeneration and survival.
adaptation	plants		adapted			By hardening off plants now , they may be better adapted to summer heat.
adaptation	plants		adapted			The plants unit can be adapted to fit o r suit the needs of any particular school setting whether it be urban , suburban or rural.
adaptation	plants		adapted			Many plants and animals have adapted to the predictable timing of climate events with finely timed behaviors.
adaptation	plants		adapted			The stream has a fall of two feet per mile and is adapted to development of water storage reservoirs and hydroelectric plants.
adaptation	plants		adapted			`` Native plants are adapted to our climate , wet in the winter , dry in the summer , landscaper Flora Cordis explained.
adaptation	plants		adapted			Everglades plants and animals are adapted to alternating wet and dry seasons.
adaptation	plants		adapted			Power plants that currently burn only coal can be easily adapted today to co-fire blends of coal and biomass.
adaptation	plants		adapted			Native plants are more adapted to regional environmental conditions than are exotic plants.
adaptation	plants	environment	adapted			The plants that do grow on these rocks are specially adapted to this particular environment.
adaptation	Plants		adapted			Plants have reasonably adapted to relatively unchanging conditions.
adaptation	plants		adapted			The plants and animals in these areas have adapted to frequent disturbances.
adaptation	plants		adapted			This category lists soil conditions for which plants are especially adapted.
adaptation	plants		adapted			They are adapted for climbing , and will need live plants and branches in their cage to feel secure.
adaptation	plants	environment	adapted			To understand that plants and animals are adapted to the environment they live in.
adaptation	plants	environment	adapted			The plants are adapted to the harsh environment of the world &#146; s mountaintops , dwarfed , and often have showy blooms.
adaptation	plants		adapted			Many native plants are narrowly adapted to particular types of soils.
adaptation	plants		adapted			Under native conditions , the plants adapted to seasonally wet soils produce about 3/4 ton/acre.
adaptation	plants		adapted			As with any group of plants in the wild , rhododendrons have adapted , over long periods of time , to various climates.
adaptation	plants		adapted			Most plants growing in the hammocks are not well adapted to survive fire.
adaptation	plants		adapted			Native plants have adapted over thousands of years to our West Coast climate.
adaptation	plants		adapted			In the rainforest plants and animals are adapted to three strata : the forest floor , the understory and the canopy.
adaptation	plants		adapted			It provides a rich legacy of plants and animals adapted to unique climactic conditions.
adaptation	plants		adapted			Wild plants taken from the same habitats will already have adapted to these conditions and are better choices.
