migrate | migration	atom double bond		movement	from one position to another	molecule	The movement of one atom or more, or of a double bond, from one position to another within a molecule.
migrate | migration	Animal		movement | migration			Animal migration is the relatively long-distance movement of individuals, usually on a seasonal basis.
adaptation	animals	live in their environment	adaptation	features		The adaptation of animals are the features an animal has to live in their environment.
adaptation	Animals plants	conditions of the habitats in which they live	adapted			Animals and plants are adapted to the conditions of the habitats in which they live.
adaptation	Plants	changes in the environment	adapted			Plants and animals have adapted to changes in the environment for millions of years.
adaptation	plants		adapt			Even well watered plants may wilt if the plant cannot adapt it transpiration rate.
adaptation	organism		inherited characteristic	survival		Inherited characteristic of an organism that enhances its survival and reproduction in specific environments.
crossbreeding	species animals plants		mixing	hybrids		the act of mixing different species or varieties of animals or plants and thus to produce hybrids
crossbreeding			mating			To produce an organism by the mating of individuals of different breeds,varieties, or species
inertia			inertia			However all internal energies of all types contribute to body's mass, inertia, and total energy.
inertia	object		inertia		resistance	A measure of inertia, indicating the resistance of an object to a change in its motion—including a change in velocity.
inertia	object		inertia		quantify the amount of matter	The inertia of the object is used to quantify the amount of matter.
inertia			inertial			An inertial balance can be used to discover the mass of an object even in a 0 gravity environment.
magnetism		force	magnetism			The force identified by a north and south pole is magnetism.
magnetism	metals		attracts			A magnet is an object that attracts metals.
magnetism		force	magnetism			The force of magnetism decreases as the magnets are pulled apart.
magnetism		magnets	attraction	magnets		the properties of attraction possessed by magnets; the molecular properties common to magnets.
magnetism			physical phenomena			Magnetism is a class of physical phenomena that are mediated by magnetic fields.
melt | melting	solid	addition of heat	melting | changing	liquid		Melting is the opposite of freezing and involves changing water from its solid state (ice) to a liquid state by the addition of heat.
melt | melting	ice		physical change | melting			Melting of ice is a physical change, not a chemical change.
melt | melting	solid	heat	changes	liquid		the process whereby heat changes something from a solid to a liquid
melt | melting	substance		physical process | phase transition	liquid		Melting is a physical process that results in the phase transition of a substance from a solid to a liquid.
melt | melting	solid	reaches the temperature of its melting point	become	liquid		When a solid reaches the temperature of its melting point, it can become a liquid.
melt | melting	solid -LRB- ice -RRB-	thermal energy	melts	liquid water		The thermal energy of the water increases as it melts, changing from a solid (ice) to liquid water.
melt | melting	water vapor		melting	liquid water		The process by which water vapor changes to liquid water is called A. melting.
melt | melting	solid ice		changes	liquid water		The melting point of water is the temperature at which it changes from solid ice into liquid water.
melt | melting	Ice		melting | physical change	water		Ice melting into water is a physical change.
boiling	water	transfer of energy through movement	boiling			Convection is the transfer of energy through movement, such as boiling water.
boiling						Steam is water vapor that is at temperatures above the boiling point of water.
boiling						The large amounts of energy required to change the state of water apply to both melting ice and boiling water.
boiling	water		boiling	bubbles		The bubbles seen when boiling water is not a chemical change.
boiling	water		phase change | boiling			Phase change examples are the melting of ice or the boiling of water.
evaporate | evaporation	water		evaporation	Clouds		Clouds get their water from evaporation.
evaporate | evaporation	oils		evaporate 			Essential oils evaporate readily and are easily damaged by light, extremes of temperature and prolonged exposure to oxygen in the air.
evaporate | evaporation	moisture		evaporation | extracting			evaporation - the process of extracting moisture
evaporate | evaporation	matter		evaporation | changes	one state to another		Evaporation and condensation are two processes through which matter changes from one state to another.
evaporate | evaporation	water liquid state		evaporation | changing	gaseous state vapor		Evaporation involves changing water from its liquid state to a gaseous state (vapor)
evaporate | evaporation	liquid		evaporation | vaporization	gaseous phase	surface of a liquid	Evaporation is a type of vaporization of a liquid that occurs from the surface of a liquid into a gaseous phase that is not saturated with the evaporating substance.
evaporate | evaporation	substance liquid state	increase in temperature and/or pressure	process | changing | evaporation	gaseous state		Evaporation is the process of a substance in a liquid state changing to a gaseous state due to an increase in temperature and/or pressure.
evaporate | evaporation	matter liquid		evaporation | changes	gas		In evaporation, matter changes from a liquid to a gas.
evaporate | evaporation	Liquid water		changing | evaporation	water vapor		Liquid water changing to water vapor is evaporation.
evaporate | evaporation	Surface water	energy of the sun	evaporated		from the earth	Surface water is evaporated from the earth by the energy of the sun.
evaporate | evaporation	liquid	temperature below the boiling point	change	vapor		The change of a liquid into a vapor at a temperature below the boiling point.
evaporate | evaporation	water		change of state | evaporation	water vapor		The change of state from water to water vapor is called evaporation.
evaporate | evaporation	liquid	heat	changing	gas		The changing of a liquid into a gas, often under the influence of heat (as in the boiling of water).
evaporate | evaporation	liquid water	energy from the sun	change | evaporate	water vapor		The energy from the sun heated the water and caused it to evaporate - change from liquid water to water vapor.
evaporate | evaporation	liquid water		process | evaporation | changing	water vapor		The process of liquid water changing into water vapor is called evaporation.
evaporate | evaporation	water		evaporated	water vapor	in the air	The water evaporated back into water vapor in the air.
evaporate | evaporation	Water		evaporates	water vapor	into the air	Water evaporates as water vapor into the air.
evaporate | evaporation	Water		evaporation		the atmosphere	Water from the oceans enters the atmosphere through evaporation.
metamorphosis	animals beetles frogs butterflies		metamorphosis			Other animals (including beetles, frogs, and butterflies) go through a process called metamorphosis.
metamorphosis	Others		metamorphosis	look and act very different from their adult parents when they first hatch .		Others go through metamorphosis and look and act very different from their adult parents when they first hatch.
metamorphosis	Butterflies and moths		life cycle | complete metamorphosis			Butterflies and moths go through a life cycle known as complete metamorphosis.
metamorphosis	animal	cell growth	biological process | metamorphosis			Metamorphosis is a biological process by which an animal physically develops after birth or hatching, involving a conspicuous and relatively abrupt change in the animal's body structure through cell growth and differentiation
metamorphosis	larva		transformation	adult form		process in which a larva undergoes a major transformation to change into the adult form, which occurs in amphibians, arthropods, and other invertebrates
pollination	Plants	animals	pollinating			Plants need the help of animals for pollinating their flowers and dispersing their seeds.
pollination	plants		cross-pollinate			The plants will cross-pollinate with each other and the characteristic of each plant will affect the other.
pollination	plants		pollinated			Parts of the Plant Before plants can produce seeds they have to be pollinated.
pollination	plants		self-pollinate			Some plants also can self-pollinate, which means they can produce seeds without fertilization by another plant.
pollination	plants		pollinated			Some of the different ways plants are pollinated.
reproduce | reproduction | reproducing			reproduce			They can grow, take in nutrients, breathe, reproduce, eliminate waste, and die.
reproduce | reproduction | reproducing	Plants		reproduce	flowers fruits		Plants reproduce by producing flowers and fruits that have seeds.
reproduce | reproduction | reproducing	organism		creates	likeness of itself		Reproduction is the process by which a living organism creates a likeness of itself.
reproduce | reproduction | reproducing	organism	process of generation propagation	produce	individuals		to produce one or more other individuals of (a given kind of organism)by some process of generation or propagation, sexual or asexual.
reproduce | reproduction | reproducing			process | produced	new individual organisms offsprings		is the biological process by which new individual organisms, offsprings, are produced from their parents.
reproduce | reproduction | reproducing	All living things	Food	reproduce			Food All living things need food (for energy) to grow and reproduce.
reproduce | reproduction | reproducing	Plants	Flowers and fruits	reproduction			Parts of Plants Flowers and fruits are the parts of plants that are for reproduction.
reproduce | reproduction | reproducing	Animals and Plants	energy	reproduction			Animals and Plants need energy for growth and reproduction.
reproduce | reproduction | reproducing	Animals and Plants	energy	reproduction			au Animals and Plants need energy for growth and reproduction.
reproduce | reproduction | reproducing	Humans , animals and plants		reproduce	their own kind		Humans, animals and plants reproduce their own kind.
reproduce | reproduction | reproducing	Plants		reproduce |  producing	flowers fruits		Plants reproduce by producing flowers and fruits that have seeds.
reproduce | reproduction | reproducing	organism		reproduction	offspring		When an organism has an offspring (baby) it is called reproduction.
reproduce | reproduction | reproducing	seed		reproduction	plant		A seed growing into a plant is a form of reproduction.
reproduce | reproduction | reproducing	Plants	male -LRB- pollen -RRB- and female eggs	forming	seeds		Plants reproduce by forming seeds from the male (pollen) and female (eggs) cells found in the flower.
reproduce | reproduction | reproducing			produced | biological process	individual organisms		Reproduction (or procreation) is the biological process by which new individual organisms, offspring, are produced from their parents.
reproduce | reproduction | reproducing			reproduce			They can grow, take in nutrients, breathe, reproduce, eliminate waste, and die.
reproduce | reproduction | reproducing	Plants		reproduce	flowers fruits		Plants reproduce by producing flowers and fruits that have seeds.
reproduce | reproduction | reproducing	organism		creates	likeness of itself		Reproduction is the process by which a living organism creates a likeness of itself.
reproduce | reproduction | reproducing	organism	process of generation propagation	produce	individuals		to produce one or more other individuals of (a given kind of organism)by some process of generation or propagation, sexual or asexual.
reproduce | reproduction | reproducing			process | produced	new individual organisms offsprings		is the biological process by which new individual organisms, offsprings, are produced from their parents.
reproduce | reproduction | reproducing	All living things	Food	reproduce			Food All living things need food (for energy) to grow and reproduce.
reproduce | reproduction | reproducing	Plants	Flowers and fruits	reproduction			Parts of Plants Flowers and fruits are the parts of plants that are for reproduction.
reproduce | reproduction | reproducing	Animals and Plants	energy	reproduction			Animals and Plants need energy for growth and reproduction.
reproduce | reproduction | reproducing	Animals and Plants	energy	reproduction			au Animals and Plants need energy for growth and reproduction.
reproduce | reproduction | reproducing	Humans , animals and plants		reproduce	their own kind		Humans, animals and plants reproduce their own kind.
reproduce | reproduction | reproducing	Plants		reproduce |  producing	flowers fruits		Plants reproduce by producing flowers and fruits that have seeds.
reproduce | reproduction | reproducing	organism		reproduction	offspring		When an organism has an offspring (baby) it is called reproduction.
reproduce | reproduction | reproducing	seed		reproduction	plant		A seed growing into a plant is a form of reproduction.
reproduce | reproduction | reproducing	Plants	male -LRB- pollen -RRB- and female eggs	forming	seeds		Plants reproduce by forming seeds from the male (pollen) and female (eggs) cells found in the flower.
reproduce | reproduction | reproducing			produced | biological process	individual organisms		Reproduction (or procreation) is the biological process by which new individual organisms, offspring, are produced from their parents.
make food	plants		process | make			Chlorophyll is used for photosynthesis, the process by which plants make food.
make food			make	food		When plants make food, they give off oxygen and water.
make food	food		makes			Food chains start with a primary producer that makes its own food.
mimicry	animals		camouflage | mimicry			The last method of camouflage animals might use is called mimicry.
mimicry	Animals		mimicry	protect themselves		Animals use concealing or disruptive coloration, disguise, and mimicry to protect themselves.
mimicry	flowers		mimicry	attract pollinators		Other flowers use mimicry to attract pollinators.
mimicry	Predators		mimicry	lure their prey		Predators may also use mimicry to lure their prey, however.
mimicry	organism		resemblance	concealment protection from predators		The resemblance of one organism to another or to an object in its surroundings for concealment and protection from predators.
mitosis		asexual reproduction	mitosis	no genetic variation duplicate the genome		There is no genetic variation produced because asexual reproduction uses mitosis as the genetic process to duplicate the genome.
mitosis			mitosis | cytokinesis	the structures in a plant cell are different than those an animal		Well, when mitosis is finished (cytokinesis) the structures in a plant cell are different than those in an animal cell.
mitosis	areas of the plant		mitosis	growth		There are areas of the plant that are capable of growth from mitosis (also known as meristems).
mitosis			mitosis	Vegetative growth		Vegetative growth continues through cell division (mitosis) and expansion in the epicotyl or growing point of the young plant.
mitosis	animal , plants/algae and fungi		life cycles			All three life cycles (animal, plants/algae and fungi) have these three key features: fertilization, undergoes mitosis and meiosis.
meiosis	animal , plants/algae and fungi		life cycles			All three life cycles (animal, plants/algae and fungi) have these three key features: fertilization, undergoes mitosis and meiosis.
meiosis			meiosis	pollen ovules		Much like pollen, the ovules are produced through meiosis and they contain half of the plant's genetic code.
meiosis	diploid cells		meiosis	haploid cells		During the process of meiosis diploid cells produce haploid cells.
meiosis	four haploid cells		meiosis	Just one egg		Just one egg is produced from the four haploid cells that result from meiosis.
meiosis			reductional division	number of chromosomes per cell is cut		process of reductional division in which the number of chromosomes per cell is cut in half.
sexual reproduction	two parents		reproduction	offspring that have unique combinations of genes inherited from the gametes parents		A type of reproduction in which two parents give rise to offspring that have unique combinations of genes inherited from the gametes of the parents.
sexual reproduction		gametes produced by two parents	reproduction | fertilization	genetically variable offspring		type of reproduction that involves the fertilization of gametes produced by two parents and produces genetically variable offspring
asexual reproduction			agamogenesis | reproduction		without the fusion of gametes	A more stringent definition is agamogenesis which is reproduction without the fusion of gametes
asexual reproduction	single-celled organisms such as the archaea , bacteria and protists		reproduction			Asexual reproduction is the primary form of reproduction for single-celled organisms such as the archaea, bacteria, and protists
asexual reproduction	single organism		reproduction	offspring arise inherit the genes of that parent only		Asexual reproduction is a mode of reproduction by which offspring arise from a single organism, and inherit the genes of that parent only
asexual reproduction	single parent		reproduction	offspring that are all genetically identical to the parent		reproduction that involves a single parent and results in offspring that are all genetically identical to the parent
asexual reproduction					occurs without the fusion of gametes	The generation of offspring from a single parent that occurs without the fusion of gametes (by budding, division of a single cell, or division of the entire organism into two or more parts).
motion	object		motion		energy	Energy: energy an object has when it is in motion.
motion	object		motion		Kinetic energy	The kinetic energy of an object is the energy it has because of its motion.
motion			change of position			A change of position with respect to time.
motion			act of moving			The act of moving from place to place.
motion			changing position			The act or process of changing position or place.
acceleration			acceleration			Earth always produces the same acceleration on every object.
acceleration			accelerate			For example, a cyclist uses chemical energy provided by food to accelerate a bicycle to a chosen speed.
acceleration			acceleration			The change in an objects velocity is called acceleration.
acceleration			accelerates			When an object accelerates its velocity is changing.
acceleration	object		acceleration			A change in the speed or direction of a moving object is called acceleration.
reflect | reflection	light from the Sun	moon	reflecting			Only the part of the moon that is reflecting the light from the Sun is changing.
reflect | reflection	something	light sound	reflects	goes in a different direction		If light or sound 'reflects' off something, it hits it and goes in a different direction.
reflect | reflection		surface	striking | falling	return throw off		To cause to return or to throw off after striking or falling on any surface, and in accordance with certain physical laws
reflect | reflection	light		throw | bend back			To throw or bend back (light, for example) from a surface
reflect | reflection	light	matter	reflected			When light interacts with matter, some of the light is transmitted, some is reflected, and some is absorbed.
move | movement						Nutrients move through a plant by the movement of water.
move | movement	water		moving | water cycle			Earths water is always moving and the water cycle describes the water on, above or below the surface of earth.
move | movement			moving			Anything that is moving has energy, and the more it’s moving, the more energy it has.
move | movement			movement			The locomotion system is responsible for movement.
move | movement			changing physical location			an act of changing physical location or position or of having this changed.
move | movement		wave action	movement of sand	sand along beach		movement of sand along a beach by wave action
breathe | breathing	us		breathe		oxygen	Plants need energy to give oxygen for us to breathe and animals need energy to search for more foods.
breathe | breathing	animals plants		breathe		oxygen	All animals and plants need oxygen to breathe.
breathe | breathing	Animals		breathe in oxygen		use it to extract energy from food	Animals breathe in oxygen and use it to extract energy from food.
breathe | breathing	plants		breathing			All the plants around you are breathing and releasing water, too.
breathe | breathing	Animals		take in air  | breathing			Animals take in air by breathing.
breathe | breathing	Humans		inhale | breathe	carbon dioxide	oxygen	Humans inhale (breathe in) oxygen and exhale (breathe out) carbon dioxide.
breathe | breathing		lungs	process | moves air in and out			Breathing is the process that moves air in and out of the lungs
breathe | breathing	mouth nose	muscle contraction relaxation	process of respiration | inhaled | exhaled			The process of respiration, during which air is inhaled into the lungs through the mouth or nose due to muscle contraction and then exhaled due to muscle relaxation.
breathe | breathing	fish		breathes | taking | forcing it out			A fish breathes by taking water into its mouth and forcing it out through the gill passages
digestion | digest food	animals	eat meat or plants	digest	get energy		(food for them) And animals eat meat or plants and digest it to get energy.
digestion | digest food	our body	breaks down the food	digestive system	can use it		The digestive system breaks down the food so our body can use it.
digestion | digest food	Animal proteins		digestible			Animal proteins are much more digestible than those of plant sources.
digestion | digest food	food		breaking down	nutrients		process of breaking down food into nutrients that can be absorbed by the blood
digestion | digest food	food		breaking down	molecules		the breaking down of food into molecules small enough for the body to absorb.
continental drift theory			continental drift | movement			Continental drift is the movement of the Earth's continents relative to each other, thus appearing to "drift" across the ocean bed.
continental drift theory			continental drift			Subduction is the main geologic force behind continental drift.
continental drift theory			lateral movement	from of crustal		the lateral movement of continents resulting from the motion of crustal plates.
continental drift theory			movement | formation | re-formation			The movement, formation, or re-formation of continents described by the theory of plate tectonics.
continental drift theory	earth		move gradually			the theory that the earth's continents move gradually over the surface of the planet on a substratum of magma.
seafloor spreading theory			seafloor spreading | process	new formed	at mid-ocean ridges	Seafloor spreading is a process that occurs at mid-ocean ridges, where new oceanic crust is formed through volcanic activity and then gradually moves away from the ridge.
symbiosis	organisms different species members		prolonged association			A close, prolonged association between two or more organisms of different species, regardless of benefit to the members.
symbiosis	organisms species		ecological relationship	different		An ecological relationship between organisms of two different species that live together in direct and intimate contact.
symbiosis	organisms species		close relationship			close relationship between organisms of different species in which at least one of the organisms benefits from the relationship
symbiosis	biological species		symbiosis | interaction			Symbiosis is close and often long-term interaction between different biological species
symbiosis	species organisms		relation	different		the relation between two different species of organisms that are interdependent; each gains benefits from the other
transpiration	plant	water	transpiration			Most of the available water is used in transpiration to pull nutrients into the plant.
transpiration	plant		transpiration	loses water		During transpiration, the plant loses water.
transpiration	Plant		transpiration | movement	water that enters a plant is lost		Water and its Movement Through the Plant Roughly 90% of the water that enters a plant is lost via transpiration.
transpiration	plant		transpiration | uptake			The main driving force of water uptake and transport into a plant is transpiration of water from leaves.
transpiration	plants	evaporation	water cycle	loss of water		Part of the water cycle that involves the loss of water from plants due to evaporation.
respiration	Both animals and plants		process of respiration	release the energy from food		Both animals and plants then release the energy from food by using the process of respiration.
respiration	plants and animals		respiration	Water vapor		Water vapor is a by-product of respiration in plants and animals.
respiration	plants and animals		respiration	Water vapor		Water vapor and respiration or breathing Water vapor is a by-product of respiration in plants and animals.
respiration	All plants and animals		process | respiration			All plants and animals on earth engage in a process called respiration.
respiration	all living organisms animals or plants		process | respiration			respiration is another process which is carried out by all living organisms animals or plants.
perspiration	animals water		perspiration			animals use the perspiration of water to cool down their bodies.
perspiration			perspiration			Spicy (hot to the taste) food increases perspiration which cools the body as it evaporates.
perspiration			Antiperspirants	the		Antiperspirants stop the body from sweating.
